ID/EAN,NOMBRE,MARCA,PRESENTACION,ID_CATEGORIA
7790787960330,Yogur Entero con Trozos de Duraznos Ilolay 150 Gr,ILOLAY,150.0 gr,060615
7793913013702,Yogur Descremado Tops con Cereales Tregar 164 Gr,TREGAR,164.0 gr,060615
7794820902813,Yogur Entero con Colchon de Frutilla Milkaut 150 Gr,MILKAUT,150.0 gr,060615
7798136870705,Yogur Descremado con Duraznos Frascos Dahi 190 Gr,DAHI,190.0 gr,060615
7790787035007,Yogur con Trozos Frutilla Pote Ilolay 150 Gr,ILOLAY,150.0 gr,060615
7791337007864,Yogur Firme Descremado Frutilla con Colageno Pote Ser 190 Gr,SER,190.0 gr,060616
7791337007628,Yogur Firme Vainilla Pote Yogurisimo 190 Gr,YOGURISIMO,190.0 gr,060616
7791337007611,Yogur Firme Frutilla Pote Yogurisimo 190 Gr,YOGURISIMO,190.0 gr,060616
7791337008212,Yogur Batido Descremado sabor Vainilla Gran Compra 120 Gr,GRAN COMPRA,120.0 gr,060616
7793913013566,Yogur Firme Descremado Vainilla Pote Tregar 125 Gr,TREGAR,125.0 gr,060616
7798136870545,Yogur Entero Firme Sabor Natural Frasco Dahi 190 Gr,DAHI,190.0 gr,060616
7794820902806,Yogur Entero Vainilla sin Lactosa Milkaut 120 Gr,MILKAUT,120.0 gr,060616
7794820902790,Yogur Entero sin Lactosa Frutilla Milkaut 120 Gr,MILKAUT,120.0 gr,060616
7791337007345,Yogur Batido Natural sin Endulzantes Ser 175 Gr,SER,175.0 gr,060616
7798136870606,Yogur Firme Descremado Natural Dahi 190 Gr,DAHI,190.0 gr,060616
7791337007604,Yogur Firme Vainilla Yogurisimo 4 Un 480 Gr,YOGURISIMO,480.0 gr,060616
7791337007161,Yogur Firme Descremado Fortificado Frutilla Gran Compra 120 Gr,GRAN COMPRA,120.0 gr,060616
7791337007598,Yogur Firme Frutilla Yogurisimo 4 Un 480 Gr,YOGURISIMO,480.0 gr,060616
7793913013689,Yogur Natural sin Azucar Tregar 140 Gr,TREGA,140.0 gr,060616
7793913013542,Yogur Parcialmente Descremado sabor Dulce de Leche Tregar 125 Gr,TREGAR,125.0 gr,060616
7790787960453,Yogur Entero Firme Sabor Vainilla Ilolay 190 Gr,ILOLAY,190.0 gr,060616
7790787960446,Yogur Entero Firme Sabor Frutilla Ilolay 190 Gr,ILOLAY,190.0 gr,060616
7790787110520,Yogur Descremado Firme Frutilla Ilolay 190 Gr,ILOLAY,200.0 gr,060616
7790787110513,Yogur Descremado Firme Vainilla Ilolay 190 Gr,ILOLAY,200.0 gr,060616
7790787004478,Yogur Batido Descremado Vainilla Ilolay 120 Gr,ILOLAY,120.0 gr,060616
7790813150131,Levadura Instantanea Mi Pan 10 Gr,MI PAN,10.0 gr,060701
7790813900989,Levadura Prensada Familiar Amasa Facil Calsa 50 Gr,CALSA,50.0 gr,060701
7790813110401,Levadura Familiar Calsa 50 Gr,CALSA,50.0 gr,060701
7790813444469,Levadura Prensada Familiar Calsa 2 Un 50 Gr,CALSA,100.0 gr,060701
7798018851211,Levadura Seca con Masa Madre Levex 13 Gr,LEVEX,13.0 gr,060701
7798018850566,Levadura Saf Instant Roja 125 Gr,SAF INSTANT,125.0 gr,060701
7790079022111,Tapa Empanadas Freir Paladini 330 Gr,PALADINI,330.0 gr,060804
7790079021374,Tapa Pascualina Hojaldre Paladini 2 Un 400 Gr,PALADINI,400.0 gr,060805
7794440994663,Balde con Escurridor 12 Lt Virulana 1 Un,SIN MARCA,1.0 un,070101
7797232006124,Fuenton 9 Lt Crom Linea Eco 1 Un,CROM,1.0 un,070101
7790773003010,Broches de Madera Ideal 12 Un,IDEAL,12.0 un,070102
7794321882010,Broches de Madera Task 12 Un,TASK,12.0 un,070102
7790560002165,Broches de Madera Sed Metal 12 Un,SED METAL,12.0 un,070102
7790773003300,Broches de Plastico Ideal 12 Un,IDEAL,12.0 un,070102
7790900002657,Broches Doble Presion Iberia 9 Un,IBERIA,9.0 un,070102
7794440017133,Cabo Metalico Virulana 1 Un,VIRULANA,1.0 un,070103
7794440007042,Escoba sin Cabo Multiuso Virulana 1 Un,VIRULANA,1.0 un,070103
7896001001671,Escoba Original sin Cabo Novica 1 Un,NOVICA,1.0 un,070103
7790560001762,Cabo Extensible Limpex 1 Un,LIMPEX,1.0 un,070103
7794440007059,Escoba para Exterior Virulana 1 Un,VIRULANA,1.0 un,070103
7896001001008,Escobillon Varry 1000 Bettanin 1 Un,BETTANIN,1.0 un,070103
7794440994205,Guantes Plisse Satinados Talle M Mapa 2 Un,MAPA,2.0 un,070104
7794440994212,Guantes Plisse Satinados Talle L Mapa 2 Un,MAPA,2.0 un,070104
7793253092276,Esponja Poderosa Mortimer 1 Un,MORTIMER,1.0 un,070104
7794440994199,Guantes Plisse Satinado Talle S Mapa 2 Un,MAPA,2.0 un,070104
7794440003341,Esponja Multiuso Fibraesponjas Virulana Un,VIRULANA,1.0 un,070104
7794440000210,Esponja Multiondas Mapa Virulana 1 Un,VIRULANA,1.0 un,070104
7793253038526,Esponja Doble Cara Bronce Mortimer 1 Un,MORTIMER,1.0 un,070104
7793253386160,Esponja Plateada Mortimer 1 Un,MORTIMER,1.0 un,070104
7794440045921,Guantes Medianos Plumita 1 Un,PLUMITA,1.0 un,070104
7794440002399,Esponja de acero Inoxidable Virulana 1 Un,VIRULANA,1.0 un,070104
7794440045938,Guantes Grandes Plumita 1 Un,PLUMITA,2.0 un,070104
7794440045914,Guantes Chicos Plumita 1 Un,PLUMITA,2.0 un,070104
7793253000349,Esponja Cuadriculada Abrasiva Mortimer 1 Un,MORTIMER,1.0 un,070104
7794440003440,Esponja con Fibra Multiuso Cuida Uñas Virulana 1 Un,VIRULANA,1.0 un,070104
7793253385712,Esponja de Bronce Inoxidable Mortimer 1 Un,MORTIMER,1.0 un,070104
7794440000104,Esponja con Fibra Roja Virulana 1 Un,VIRULANA,1.0 un,070104
7794440003303,Esponja con Cuadraditos y Cuida Uñas Virulana 1 Un,VIRULANA,1.0 un,070104
7794440003310,Esponja Pintada Lisa Virulana 1 Un,VIRULANA,1.0 un,070104
7794440994229,Guantes de Latex Plisse Satinados Extra Grandes Mapa 1 Un,MAPA,1.0 un,070104
7896001004528,Esponja Salva Uñas Bettanin Esfrebom 1 Un,BETTANIN,1.0 un,070104
7896001004870,Esponja Brilhus Protege Uñas Bettanin 1 Un,BETTANIN,1.0 un,070104
7798008381513,Guantes Mediano Bolsa Patito 2 Un,PATITO,2.0 un,070104
7790560001113,Esponja con Fibra Salvauñas Sed Metal 1 Un,SED METAL,1.0 un,070104
7798008381506,Guantes Chicos Patito 2 Un,PATITO,2.0 un,070104
7798008381520,Guantes Grandes Patito 2 Un,PATITO,2.0 un,070104
7798008381537,Guantes XL Clasicos Patito 2 Un,PATITO,2.0 un,070104
7793253000523,Paño Multiuso Multicolor 38 Cm 36 Cm Mortimer 1 Un,MORTIMER,1.0 un,070105
7794440005109,Paño Twist Virulana 1 Un,VIRULANA,1.0 un,070105
7793253000509,Paño Multiuso Amarillo 38x36 Cm Mortimer 1 Un,MORTIMER,1.0 un,070105
7794440005345,Paño Esponja Antibacterial Virulana 3 Un,VIRULANA,1.0 un,070105
7794440005116,Paños Twist Virulana 3 Un,VIRULANA,3.0 un,070105
7791290792951,Paño Multiuso Antibacterial Ballerina 3 Un,CIF,3.0 un,070105
7790560000802,Paño Antibacterias Sed Metal 3 Un,SED METAL,3.0 un,070105
7790560003803,Paño Antibacterias Sed Metal 1 Un,SED METAL,1.0 un,070105
7793253000516,Paño Multiuso Amarillo de 38 Cm 36 Cm Mortimer 2 Un,MORTIMER,2.0 un,070105
7794440000203,Paños Multiuso Mapa Virulana 4 Un,VIRULANA,4.0 un,070105
7896001012516,Secador Novica Ballena P 1 Un,NOVICA,1.0 un,070106
7794440007189,Secador de Pisos de 40 Cm Virulana 1 Un,VIRULANA,1.0 un,070106
7896001001268,Secador Ballena Novica 40 Cm 1 Un,NOVICA,1.0 un,070106
7798184586139,Absorbe Humedad Repuesto Lavanda Purific Air 80 Gr,PURIFIC AIR,80.0 gr,070201
7798184581677,Absorbe Humedad Lavanda Purific Air 75 Gr,PURIFIC AIR,75.0 gr,070201
7790520996015,Desodorante de Ambientes Automatico Repuesto Lavanda y Vainilla Glade 175 Gr,GLADE,175.0 gr,070202
7793253004248,Aromatizante Ambiente Aerosol Fragancia Primavera Poett 360 Ml,POETT,360.0 ml,070202
7790520995971,Aromatizador Auto Repuesto Lavanda y Vainilla Glade 175 Gr,GLADE,185.0 gr,070202
7790520995964,Aromatizador Repuesto Automatico Limon Glade 170 Ml,GLADE,170.0 ml,070202
7790520996138,Desodorante de Ambientes Limon Full Glade Toque 9 Gr,GLADE TOQUE,9.0 gr,070202
7790520996169,Desodorante de Ambientes Toque Repuesto Limon Glade 12 Ml,GLADE,12.0 ml,070202
7793253004262,Aromatizante Ambientes en Aerosol Suavidad de Algodon Poett 360 Ml,POETT,360.0 ml,070202
7790520996077,Aromatizante de Ambientes Repuesto Automatico Aerosol Vainilla Glade 270 Ml,GLADE AUTOMATIC,270.0 gr,070202
7790520996053,Aromatizador de Ambientes Repuesto Limon Glade 175 Gr,GLADE,175.0 gr,070202
7790520996237,Desodorante de Ambientes Twin Pack Limon Glade Toque 2 Un 9 Gr,GLADE TOQUE,9.0 gr,070202
7790520995988,Repuesto Aromatizante de Ambientes Spray Manzana y Canela Glade 175 Gr,GLADE,175.0 gr,070202
7790520019820,Desodorante Minigel para Auto Aqua Glade 70 Gr,GLADE,70.0 gr,070202
7793253004323,Aromatizante Ambiente Aerosol Espiritu Joven Poett 360 Ml,POETT,360.0 ml,070202
7790520996008,Repuesto Aromatizante de Ambientes Spray Hawaiian Breeze Glade 175 Gr,GLADE,175.0 gr,070202
7793253002299,Repuesto Aromatizante Primavera y Bebe Poett Intense Pack 2 Un 18 Ml,POETT,18.0 ml,070202
7790520996022,Aromatizante de Ambientes Paraiso Azul Aerosol Glade 270 Ml,GLADE,270.0 ml,070202
7790520997708,Difusor Automatico de Ambientes Lavanda y Vainilla Glade 270 Ml,GLADE,270.0 ml,070202
7790520019868,Aromatizante de Ambiente en Gel Limon Refrescante Glade 70 Gr,GLADE,176.0 cc,070202
7793253004255,Aromatizante Ambiente en Aerosol Fragancia Bebe Poett 360 Ml,POETT,360.0 ml,070202
7790520999535,Repuesto Aromatizante de Ambiente Aceite Vainilla Glade 21 Ml,GLADE,21.0 ml,070202
7790520999528,Repuesto Aromatizante de Ambiente Liquido Flores Tropicales y Coco Blister Glade 21 Ml,GLADE,21.0 ml,070202
7790520999498,Aromatizador Electrico con Difusor en Aceite Mix Aceites Naturales Glade 21 Cc,GLADE,21.0 cc,070202
7790520996220,Desodorante de Ambientes Placer Floral y Frutos Rojos Repuesto Glade Toque 9 Gr,GLADE TOQUE,9.0 gr,070202
7790520019851,Aromatizante de Ambiente en Gel Lavanda Glade 70 Gr,GLADE,176.0 cc,070202
7790520996145,Desodorante de Ambientes Toque Repuesto Lavanda Glade 12 Ml,GLADE,12.0 ml,070202
7790520996145,Desodorante de Ambientes Toque Repuesto Lavanda Glade 12 Ml,GLADE,12.0 ml,070202
7790520019851,Aromatizante de Ambiente en Gel Lavanda Glade 70 Gr,GLADE,176.0 cc,070202
7790520996039,Aromatizante de Ambiente Difusor Automatico Floral y Frutos Repuesto Glade 270 Ml,GLADE,270.0 ml,070202
7790520999511,Repuesto Aromatizante de Ambiente Aceite Harmony Aeerosol Glade 9 Gr,GLADE,9.0 gr,070202
7790520999573,Repuesto Aromatizante de Ambiente Aceite Vainilla Glade 2 Un 21 Ml,GLADE,21.0 ml,070202
7793253001551,Desodorante Ambiente Lavanda Repuesto Poett Intense 9 Gr Pack 2 Un,POETT,9.0 gr,070202
7501058766540,Desodorante Ambiente Citrico Repuesto Aerosol Air Wick 250 Ml,AIR WICK,250.0 ml,070202
7793253170622,Aromatizante de Ambiente Fragancia Floral Poett 400 Ml,POETT,400.0 ml,070202
7791905004134,Aromatizante de Ambientes Naranja Cookies Repuesto Harpers 220 Cc,HARPERS,1.0 un,070202
7791905004141,Aromatizante Ambiente Limon Harpers 220 Cc,HARPERS,1.0 un,070202
7791905023197,Desodorante de Ambiente Lavanda Harpers 220 Ml,HARPERS,220.0 ml,070202
7793253005054,Desinfectante en Aerosol Original Ayudin 332 Ml,AYUDÍN,332.0 ml,070203
7793253005238,Desinfectante Multisuperficies Expet Doypack Ayudin 450 Ml,AYUDÍN,450.0 ml,070203
7790520995308,Desinfectante Ambientes y Superficie Aerosol Bebe Lysoform 360 Ml,LYSOFORM,360.0 ml,070203
7790520996961,Desinfectante de Ambiente Aire de Montaña Aerosol Lysoform 495 Cc,LYSOFORM,495.0 cc,070203
7790520989932,Limpiador Liquido Desinfectante Concentrado Original Lysoform 800 Ml,LYSOFORM,800.0 ml,070203
7793253004729,Limpiador Desinfectante Marina Ayudin 900 Ml,AYUDÍN,900.0 ml,070204
7790520997654,Mata Cucarachas Exterminador Aerosol Raid 360 Ml,RAID,360.0 ml,070301
7790520025777,Mata Cucarachas y Arañas sin Olor Aerosol Raid Max 360 Ml,RAID,360.0 ml,070301
7790520986160,Jeringa en Gel Mata Cucarachas Raid 3 Gr,RAID,3.0 gr,070301
7790520025746,Mata Hormigas en Aerosol Raid Max 360 Ml,RAID,360.0 ml,070301
7790520025869,Mata Mosca Mosquito Acuosa Aerosol Fuyi 360 Cc,FUYI,360.0 cc,070302
7790520997623,Mata Moscas y Mosquitos Aerosol Raid 370 Ml,RAID,370.0 ml,070302
7790520508607,Insecticida Mata Moscas y Mosquitos sin Olor en Aerosol Raid 360 Cc,RAID,360.0 cc,070302
7790520995360,Tabletas Mata Mosquitos Doble Accion Raid 24 Un,RAID,24.0 un,070302
7790520009746,Aparato Insecticida Liquido Electrico 45 Noches Doble Accion Raid 32.9 Cc,RAID,119.0 cc,070302
7790520025845,Tabletas Mata Moscas Mosquitos Fuyi 24 Un,FUYÍ,24.0 un,070302
7790520997432,Blister Aparato Electrico + Repuesto Liquido 45 Noches Raid 1 Un,RAID,1.0 un,070302
7790520025715,Mata Polillas y Larvas Aerosol Raid 360 Ml,RAID,360.0 ml,070303
7790520025722,Mata Pulgas y Garrapatas Aerosol 390 Ml,RAID,390.0 ml,070303
7790520009494,Repelente Family Active Aerosol Off 165 Cc,OFF!,165.0 cc,070304
7790520025395,Repelente en Aerosol Family Off 170 Ml,OFF,170.0 ml,070304
7790520998958,Repelente en Crema Kids Off 100 Gr,OFF KIDS,100.0 gr,070304
7791274200274,Repelente Spray Vais 120 Ml,VAIS,120.0 ml,070304
7793253003807,Lavandina en Gel Citrica Ayudin 700 Ml,AYUDÍN,700.0 ml,070401
7798184581059,Lavandina Granulada Multimax 40 Gr,MULTIMAX,40.0 gr,070401
7790132098459,Lavandina Concentrada Ayudin 1 Lt,AYUDÍN,1.0 lt,070402
7793253002589,Lavandina Ayudin Ropa Blanca 450 Cc,AYUDÍN,450.0 cc,070402
7793253003715,Lavandina Lavanda Triple Accion Ayudin 1 Lt,AYUDÍN,1.0 lt,070402
7798131250380,Lavandina Aditivada Naranja Heroe 1 Lt,HÉROE,1.0 lt,070402
7793253003234,Lavandina para Ropa Ayudin 400 Ml,AYUDÍN,400.0 ml,070402
7793253003746,Lavandina Glaciar Triple Poder Ayudin 1 Lt,AYUDÍN,1.0 lt,070402
7791905023203,Lavandina Comun Odex 1 Lt,ODEX,1.0 lt,070402
7791905023210,Lavandina Comun Odex 2 Lt,ODEX,2.0 lt,070402
7791905003663,Lavandina Aditivada Ropa Blanca Querubin 1 Lt,QUERUBÍN,1.0 lt,070402
7798131250502,Lavandina Tradicional Heroe 4 Lt,HÉROE,4.0 lt,070402
6001298008123,Bolsas Hermeticas Multipack con Cierre Dentado Ziploc 9 Un,ZIPLOC,9.0 un,070501
7790117000231,Bolsas de Residuos de 50 Cm 70 Cm Asurin 30 Un,ASURÍN,30.0 un,070501
7790117000200,Bolsas de Residuos de 45 Cm 60 Cm en Rollo Asurin 30 Un,ASURÍN,30.0 un,070501
7790117061843,Bolsas de Residuos Cierra Facil Rollo 50x65 Cm Asurin 20 Un,ASURÍN,20.0 un,070501
7790117061836,Bolsas de Residuos Cierra Facil Rollo 45x55 Cm Asurin 20 Un,ASURÍN,20.0 un,070501
7790117061850,Bolsas de Residuos Consorcio Rollo 60x95 Cm Cierra Facil Asurin 10 Un,ASURÍN,10.0 un,070501
7794321801172,Bolsa Cierra Facil 45x55 Cm Task 20 Un,TASK,20.0 un,070501
7794321550209,Bolsas de Residuos de 45x60 Cm Task 20 Un,TASK,20.0 un,070501
7790117000033,Bolsas de Residuos de 60 Cm 100 Cm Asurin 10 Un,ASURÍN,10.0 un,070501
7790117061300,Bolsas de Residuos de 34 Cm 38 Cm Asurin 30 Un,ASURÍN,30.0 un,070501
7790117061829,Bolsas de Residuos Rollo 45x55 Cm Cierra Facil Asurin 20 Un,ASURÍN,20.0 un,070501
7794321001770,Bolsas de Residuos de 45 Cm 60 Cm Verdes Task 20 Un,TASK,20.0 un,070501
7794321801196,Bolsa Cierra Facil 60x95 Cm Task 20 Un,TASK,20.0 un,070501
7791290794108,Detergente Liquido Bioactive Lima Cif 300 Ml,CIF,300.0 ml,070502
7791290794054,Detergente Liquido Bioactive Limon Cif 300 Ml,CIF,300.0 ml,070502
7791290794115,Detergente Liquido Bioactive Lima Cif 500 Ml,CIF,500.0 ml,070502
7791290794061,Detergente Liquido Bioactive Limon Cif 500 Ml,CIF,500.0 ml,070502
7791290794078,Detergente Liquido Bioactive Limon Cif 750 Ml,CIF,750.0 ml,070502
7791290794276,Detergente Liquido Concentrado Limon Ala 300 Ml,ALA,300.0 ml,070502
7805000321970,Sal Regeneradora Antisarro para Lavavajilla Caja Sun 1 Kg,SUN,1.0 kg,070502
7798131250472,Lavavajillas Heroe Limon 300 Ml,HÉROE,300.0 ml,070502
7790990999868,Lavavajilla Ultra Limon Zorro 500 Ml,ZORRO,500.0 ml,070502
7791130963312,Detergente en Tabletas para Maquina Lavavajilla Finish 15 Un,FINISH,15.0 un,070502
7790773034014,Escarbadientes Ideal 50 Un,IDEAL,50.0 un,070503
7790773034915,Escarbadientes de Mesa en Blister Ideal 100 Un,IDEAL,100.0 un,070503
7790900006617,Escarbadientes en Blister Iberia Deluxe Dos Picos 160 Un,DOS PICOS,160.0 un,070503
7790773034021,Escarbadientes Ideal 100 Un,IDEAL,100.0 un,070503
7790773034502,Palitos para Brochette Ideal 25 Un,IDEAL,25.0 un,070504
7790520998927,Limpia Hornos Mr Musculo 360 Ml,MR MÚSCULO,360.0 ml,070505
7791130002752,Limpiador de Cocina Antigrasa Espuma en Doypack Procenex 420 Ml,PROCENEX,420.0 ml,070505
7791290794221,Limpiador en Crema Multiuso Original Bioactive Cif 500 Ml,CIF,500.0 ml,070505
7790520998842,Limpiador Liquido Antigrasa Cocina Extra Power Doypack Mr.Musculo 450 Ml,MR. MÚSCULO,450.0 ml,070505
7791290793804,Liquido Antigrasa Gatillo Cif 513 Ml,CIF,513.0 ml,070505
7791290793378,Crema Limpiadora Multiuso Rosas y Jazmines Cif Bioactive 750 Ml,CIF BIOACTIVE,750.0 ml,070505
7791290793781,Limpiador Cremoso Cif 750 Gr,CIF,750.0 gr,070505
7793253003579,Limpiador Liquido Solo Para Ti Poett 900 Ml,POETT,900.0 ml,070505
7793253005313,Limpiador de Cocina Poder Activo Doypack Ayudin 450 Ml,AYUDÍN,450.0 ml,070505
7790520998903,Limpiador Liquido Antigrasa Cocina Doypack Mr.Musculo 900 Ml,MR. MÚSCULO,900.0 ml,070505
7790520998880,Limpiar Antigrasa Cocina Doypack Mr Musculo 450 Ml,MR. MÚSCULO,450.0 ml,070505
7790520010308,Limpiador con Pino Repuesto Mr Musculo 50 Ml,MR MÚSCULO,50.0 ml,070505
7791905004387,Limpiador Liquido para Cocina Doypack Odex 450 Ml,ODEX,450.0 ml,070505
7793253003593,Limpiador Liquido Solo Para Ti Poett 4 Lt,POETT,4.0 lt,070505
7790520018618,Limpiavidrio y Multiuso Campo de Lavanda en Doypack Mr Musculo 450 Cc,MR MÚSCULO,450.0 cc,070506
7790520018656,Limpiador Vidrios y Multiusos Doypack Mr Musculo 900 Cc,MR MÚSCULO,900.0 cc,070506
7794440007127,Secavidrio Limpiador Virulana 1 Un,VIRULANA,1.0 un,070506
7791905004363,Limpiador Liquido Vidrios Doypack Odex 450 Ml,ODEX,450.0 ml,070506
7791190000088,Vela Buenos Dias 120 Gr,BUENOS DÍAS,4.0 un,070507
7791130001212,Apresto en Doypack Robin 900 Cc,ROBIN,900.0 cc,070601
7896001002500,Cepillo para Ropa Sket Bettanin 1 Un,BETTANIN,1.0 un,070602
7791290793460,Jabon de Lavar en Pan Fragancia Coco Ala 2 Un 200 Gr,ALA,200.0 gr,070603
7791290793453,Jabon de Lavar en Pan Fragancia Coco Ala 200 Gr,ALA,200.0 gr,070603
7790990001813,Jabon para Ropa Pan Blanqueador Gran Federal 150 Gr,GRAN FEDERAL,150.0 gr,070603
7790990001776,Jabon para Ropa Pan Clasuci Zorro 2 Un 150 Gr,ZORRO,150.0 gr,070603
7791290792104,Jabon en Polvo Eco Lavado Ala 3 Kg,ALA,3.0 kg,070604
7790990002230,Jabon en Polvo para Ropa Regular Plus Duo Zorro 800 Gr,ZORRO,800.0 gr,070604
7791290793545,Jabon en Polvo para Ropa Baja Espuma Bio Enzimas Skip 2.5 Kg,SKIP,2.5 kg,070604
7791290792159,Jabon en Polvo para Ropa Eco Lavado Mañana de Sol Ala Matic 3 Kg,ALA,3.0 kg,070604
7791290792081,Jabon en Polvo Matic Eco Lavado Ala 800 Gr,ALA,800.0 gr,070604
7791290795020,Jabon en Polvo para Ropa Matic Limon Granby 3 Kg,GRANBY,3.0 kg,070604
7790990002278,Jabon en Polvo Matic Zorro Plus 400 Gr,ZORRO,400.0 gr,070604
7791290792067,Jabon en Polvo Eco Lavado a Mano Ala 400 Gr,ALA,400.0 gr,070604
7791290792098,Jabon en Polvo Eco Lavado Ala Matic 400 Gr,ALA MATIC,400.0 gr,070604
7791290792012,Jabon Liquido Matic Doypack Ala 800 Ml,ALA,800.0 ml,070605
7791290792036,Jabon Liquido para Ropa Eco Lavado Doypack Ala Matic 3 Lt,ALA MATIC,3.0 lt,070605
7791290794290,Detergente Liquido Concentrado Pomelo Ala 300 Cc,ALA,300.0 cc,070605
7791290794306,Detergente Liquido Concentrado Pomelo Ala 500 Cc,ALA,500.0 cc,070605
7791290794283,Detergente Liquido Ultra Limon Ala 500 Cc,ALA,500.0 cc,070605
7791130001649,Jabon Liquido Ropa de Bebe en Doypack Woolite 450 Cc,WOOLITE,450.0 cc,070605
7798131250519,Liquido Para Lavar Ropa Doypack Heroe 3 Lt,HÉROE,3.0 lt,070605
7791290794313,Detergente Liquido Concentrado Oceano Ala 300 Cc,ALA,300.0 cc,070605
7790990001851,Jabon Liquido para Ropa Quitamanchas Evolution Zorro 3 Lt,EVOLUTION,3.0 lt,070605
7791290795280,Detergente Ropa Fina Matic Camellito Doypack Ala 450 Ml,ALA,450.0 ml,070605
7798131250427,Liquido Lavar Ropa Baja Espuma Heroe Cuida Tus Colores 800 Ml,HÉROE,800.0 ml,070605
7791905003366,Jabon Liquido Ropa en Doypack Querubin 3 Lt,QUERUBÍN,3.0 lt,070605
7791290795297,Detergente Ropa Fina Matic Hipoalergenico Doypack Ala 900 Ml,ALA CAMELLITO,900.0 ml,070605
7793253003272,Perfume para Ropa Sedosa Primavera Doypack Poett 250 Ml,POETT,250.0 ml,070606
7793253098766,Perfume para Ropa Fragancia Suavidad de Bebe Poett 250 Ml,POETT,250.0 ml,070606
7793253099060,Repuesto Aromatizante de Telas Sedosa Primavera Poett 450 Cc,POETT,450.0 cc,070606
7793253003050,Perfume de Tela Fraganza Alegra Tu Dia Poett 250 Ml,POETT,250.0 ml,070606
7793253003289,Perfume Tela Fragancia Suavidad Algodon Doypack Poett 250 Ml,POETT,250.0 ml,070606
7793253003296,Perfume para Ropa Suavidad Bebe Doypack Poett 250 Ml,POETT,250.0 ml,070606
7793253098803,Perfume para Ropa Fragancia Frescura de Rocio Fraganza Poett 250 Ml,POETT,250.0 ml,070606
7793253098711,Perfume para Ropa Fragancia Suavidad de Algodon Poett 250 Ml,POETT,250.0 ml,070606
7798279510544,Aromatizante de Telas Verbena Gatillo Feel Smell 500 Ml,FEEL & SMELL,500.0 ml,070606
7793253003241,Quitamanchas Liquido para Ropa Doypack Ayudin 650 Ml,AYUDÍN,650.0 ml,070607
7793253001186,Quitamanchas Efecto Espuma en Doypack Trenet Oxi 400 Cc,TRENET,400.0 cc,070607
7793253401030,Quitamanchas a Bolilla Anatomico Trenet 120 Ml,TRENET,120.0 ml,070607
7793253004774,Quitamanchas Blancos Intensos Aroma Floral Botella Ayudin 1 Lt,AYUDÍN,1.0 lt,070607
7791130002240,Quitamanchas Multiuso Vanish 400 Ml,VANISH,400.0 ml,070607
7501058753441,Quitamanchas Pink Vanish 120 Gr,VANISH,120.0 gr,070607
7793253003265,Quitamanchas Liquido Blanco Supremo Doypack Ayudin 650 Ml,AYUDÍN,650.0 ml,070607
7793253003258,Quitamanchas Blanco Extremo Doypack Ayudin 400 Ml,AYUDÍN,400.0 ml,070607
7702626214832,Quitamanchas Polvo Blanco Doypack Vanish 450 Gr,VANISH,450.0 gr,070607
7793253001162,Quitamanchas Efecto Espuma Trenet Oxi 500 Cc,TRENET,500.0 cc,070607
7891035040276,Quitamanchas Super Barra White Vanish 75 Gr,VANISH,75.0 gr,070607
7791130001762,Quitamanchas Oxi Gel en Doypack Vanish 400 Ml,VANISH,400.0 ml,070607
7791130002271,Quitamanchas para Ropa en Doypack Vanish Withe 400 Ml,VANISH,400.0 ml,070607
7793253003425,Quitamanchas Ropa Blancos Supremos Ayudin 700 Ml,AYUDÍN,700.0 ml,070607
7793253002565,Quitamanchas Ayudin Ropa Color 450 Cc,AYUDÍN,450.0 cc,070607
7891150000971,Suavizante para Ropa Concentrado Cuidado Intesivo Comfor 500 Ml,COMFORT,500.0 ml,070608
7791290793682,Suavizante para Ropa Clasuci Doypack Comfort 900 Ml,COMFORT,900.0 ml,070608
7791290793583,Suavizante para Ropa Concentrado Cuidado Esencial Doypack Comfort 450 Ml,COMFORT,450.0 ml,070608
7506195143834,Suavizante Concentrado Brisa de Verano Downy Botella 500 Cc,DOWNY,500.0 cc,070608
7791290793675,Suavizante de Ropa Original Doypack Comfort 3 Lt,COMFORT,3.0 lt,070608
7791290793576,Suavizante paraw Ropa Concentrado Cuidado Intensivo Doypack Comfort 1 Lt,COMFORT,1.0 lt,070608
7798131250038,Suavizante para Ropa Frescura Matinal Heroe 900 Cc,HÉROE,900.0 cc,070608
7506195143858,Enjuague para Ropa Concentrado Lirios de Campo Downy 500 Ml,DOWNY,500.0 ml,070608
7791905000921,Suavizante para Ropa Premium Querubin 900 Cc,QUERUBÍN,900.0 cc,070608
7790520006479,Limpiador Cremoso Lysoform 450 Ml,LYSOFORM,450.0 ml,070701
7790520992574,Limpiador Desinfectacte Destructor Sarro Citrus Pato Purific 500 Ml,PATO PURIFIC,500.0 ml,070703
7791130681391,Limpiador para Inodoros Original Harpic 500 Ml,HARPIC,500.0 ml,070704
7793253005283,Limpiador Liquido Baño Limpieza Activa Doypack Ayudin 450 Ml,AYUDÍN,450.0 ml,070704
7791130681421,Limpiador para Inodoros Fragancia Citrus en Botella Harpic 500 Ml,HARPIC,500.0 ml,070704
7791130681438,Limpiador para Inodoros Blanco y Brillante en Botella Harpic 500 Ml,HARPIC,500.0 ml,070704
7791905004400,Limpiador Liquido Baño Doypack Odex 450 Ml,ODEX,450.0 ml,070704
7790520010285,Limpiador Continuo Inodoros Marina Unidad Completa Mr Musculo 50 Ml,MR MÚSCULO,50.0 ml,070705
7793253300081,Pastilla Inodoro Canasta Ayudin 16 Gr,AYUDÍN,16.0 gr,070705
7790520010292,Limpiador Continuo Para Inodoros con Marina Repuesto Mr Musculo 50 Ml,MR MÚSCULO,50.0 ml,070705
7790520014863,Bloque para Mochila 4 en 1 Mr Musculo 260 Cc,MR MÚSCULO,260.0 cc,070705
7793253002534,Desodorante para Inodoro en Canasta Repuesto Poett 32 Gr,POETT,32.0 gr,070705
7790520020819,Repuesto Disco Adhesivo para Inodoro Fragancia Citrico Lysoform 38 Gr,LYSOFORM,38.0 gr,070705
7790520024510,Bloque para Mochila de Inodoro Lysoform 2 Un,LYSOFORM,2.0 un,070705
7790520010506,Repuesto Disco Adhesivo para Inodoro Marina Mr Musculo 36 Gr,MR MÚSCULO,36.0 gr,070705
7790520992710,Discos Activos Tropical 6 Discos Pato Purific 1 Un,PATO PURIFIC,1.0 un,070705
7793253002527,Desodorante para Inodoro en Canasta Poett 50 Gr,POETT,50.0 gr,070705
7791130003582,Pastilla Inodoro Pino Harpic 1 Un,HARPIC,1.0 un,070705
7791130001687,Autobrillo Negro para Calzados Cobra 60 Ml,COBRA,60.0 ml,070801
7793350000907,Pomada Incolora Wassington 30 Gr,WASSINGTON,30.0 gr,070803
7793350000402,Pomada Liquida para Calzado Negra Wassington 60 Cc,WASSINGTON,60.0 cc,070803
7793350102304,Pomada para Zapatos Negra Wassington 32 Gr,WASSINGTON,32.0 gr,070803
7793350000891,Pomada para Calzado Marron Wassington Premium 30 Gr,WASSINGTON,30.0 gr,070803
7793350992950,Pomada para Zapatos Wassington 39 Gr,WASSINGTON,39.0 gr,070803
7793350000433,Pomada Liquida para Calzado Incolora en Botella Wassington 60 Cc,WASSINGTON,60.0 cc,070803
7790520995650,Autobrillo Incoloro Ceramicol 450 Ml,CERAMICOL,450.0 ml,070901
7790520995605,Cera Liquida para Ceramicos Rojo Doypack Blem 15 Un 450 Ml,BLEM,450.0 ml,070901
7790613071544,Cera Roble Oscuro Suiza 450 Cc,SUIZA,450.0 cc,070901
7790613071537,Cera Pasta Roble Claro Suiza 450 Cc,SUIZA,450.0 cc,070901
7790613071087,Autobrillo Pisos Incoloro en Doypack Siuza 400 Cc,SUIZA,400.0 cc,070901
7790520993090,Autobrillo Rojo Botella Ceramicol 800 Cc,CERAMICOL,800.0 cc,070901
7790613071520,Cera Pasta Natural Suiza 360 Ml,SUIZA,360.0 ml,070901
7790613071100,Autobrillo Pisos de Ceramica y Mosaicos Rojo Suiza 400 Cc,SUIZA,400.0 cc,070901
7790613000254,Autobrillo Pisos Negro Suiza 900 Cc,SUIZA,900.0 cc,070901
