ID/EAN,NOMBRE,MARCA,PRESENTACION,ID_CATEGORIA
7793008018025,Protector Solar Humecta y Protege Factor 30 Pomo Villeneuve 250 Ml,VILLENEUVE,250.0 ml,090212
7702003008511,Bronceador con Extracto de Zanahoria Factor 6 Nivea 200 Ml,NIVEA,200.0 ml,090212
7791274002830,Protector Solar FPS 30 en Pomo Cocoa Beach 130 Ml,COCOA BEACH,130.0 ml,090212
7793008017950,Protector Solar Humecta y Protege Factor 30 Pomo Villeneuve 120 Ml,VILLENEUVE,120.0 ml,090212
7793008017967,Protector Solar en Crema Factor 40 Villeneuve 120 Ml,VILLENEUVE,120.0 ml,090212
7793008017981,Protector Solar Humecta y Protege Factor 50 Pomo Villeneuve 120 Ml,VILLENEUVE,120.0 ml,090212
7793008018032,Protector Solar Humecta y Protege Factor 50 Pomo Villeneuve 250 Ml,VILLENEUVE,250.0 ml,090212
7793008018100,Aceite Protector Fps 10 Spray Villeneuve 190 Ml,VILLENEUVE,190.0 ml,090212
7793742003738,Protector Solar F50 Niños Spray Dermaglos 170 Ml,DERMAGLÓS,170.0 ml,090212
7793742003776,Protector Solar F50 Spray Continuo Dermaglos 170 Gr,DERMAGLÓS,170.0 gr,090212
7793742004735,Protector Solar Factor 30 Dermaglos 200 Ml,DERMAGLÓS,200.0 ml,090212
7793742004759,Protector Solar Efecto Seco Factor 50 Dermaglos 50 Gr,DERMAGLÓS,50.0 gr,090212
7793742024627,Protector Solar Emulsion Factor 50 Dermaglos 380 Ml,DERMAGLÓS,380.0 ml,090212
4005900954541,Locion Autobronceante Reafirmante Q10 Nivea 400 Ml,NIVEA BODY,400.0 ml,090212
7790416066426,Quitaesmalte Humectante con Almendra Cutex 50 Ml,CUTEX,50.0 ml,090213
7790416066525,Quitaesmalte Cutex Fortalecedor Botella 50 Ml,CUTEX,50.0 ml,090213
7791274005329,Quitaesmalte Keratina Rapida Accion Algabo 100 Ml,ALGABO,100.0 ml,090213
7790416066631,Quitaesmalte Cutex Hipoalergenico Botella 100 Ml,CUTEX,100.0 ml,090213
7790416066624,Quitaesmalte Cutex Hipoalergenico Botella 50 Ml,CUTEX,50.0 ml,090213
7791274005275,Quitaesmalte Fortalecedor Algabo 50 Cc,ALGABO,50.0 cc,090213
7790416018616,Quitaesmalte Hipoalergenico Cutex 200 Ml,CUTEX,200.0 ml,090213
7791274198069,Polvo Desodorante para Pies Rosa Algabo 180 Gr,ALGABO,180.0 gr,090214
7791274198045,Polvo Desodorante para Pies Celeste Algabo 180 Gr,ALGABO,180.0 gr,090214
7791274198052,Polvo Desodorante para Pies Doypack Celeste Algabo 200 Gr,ALGABO,200.0 gr,090214
7791293044477,Talco Efficient Original Rexona 100 Gr,REXONA,100.0 gr,090214
7791293044491,Polvo Pedico Efficient Original Rexona 200 Gr,REXONA,200.0 gr,090214
7891010254773,Tampones Medio O.B. 8 Un,O.B.,8.0 un,090215
7891010254780,Tampones Super O.B. 8 Un,O.B.,8.0 un,090215
7891010254803,Tampones Super O.B. 16 Un,O.B.,16.0 un,090215
7891010254797,Tampones Medio O.B. 16 Un,O.B.,16.0 un,090215
7891010254766,Tampones Mini O.B. 8 Un,O.B.,8.0 un,090215
7702026194697,Tampones Super Nosotras 8 Cu,NOSOTRAS,8.0 un,090215
7702425543966,Tampones Medio Kotex 20 Un,KOTEX,20.0 un,090215
7702026194703,Tampones Mini Nosotras 8 Un,NOSOTRAS,8.0 un,090215
7500435229562,Toalla Femenina Seca Doble Proteccion Always Xtra 16 Un,ALWAYS,16.0 un,090216
7790010002769,Toallas Femeninas con Alas Ultrafina Suave Siempre Libre 8 Un,SIEMPRE LIBRE,8.0 un,090216
7790010002776,Toallas Femeninas con Alas Tanga Siempre Libre 8 Un,SIEMPRE LIBRE,8.0 un,090216
7794626010842,Toalla Femenina para Incontinencia Leve Antibacterial Plenitud 14 Un,PLENITUD,14.0 un,090216
7500435229517,Toallas Femeninas con Alas Noches Tranquilas Suave Always 16 Un,ALWAYS,16.0 un,090216
7790010002653,Toallas Femeninas con Alas Adapt Suave Siempre Libre 8 Un,SIEMPRE LIBRE,8.0 un,090216
7790010002615,Toallas Femeninas con Alas Adapt Plus Noche y Dia Siempre Libre 8 Un,SIEMPRE LIBRE,8.0 un,090216
7790770601912,Toallas Femeninas Normal con Calendula Nosotras 16 Un,NOSOTRAS,16.0 un,090216
7794626010828,Toalla Femenina Normal con Alas Kotex 16 Un,KOTEX,16.0 un,090216
7500435229500,Toallas Femeninas con Alas Noches Tranquilas Suave Always 8 Un,ALWAYS,8.0 un,090216
7790010003162,Siempre Libre Espciales Toalla Femeninas 8 Un,SIEMPRE LIBRE,8.0 un,090216
7790010002752,Toallas Femeninas con Alas Adapt Plus Ultra Fina Siempre Libre 8 Un,SIEMPRE LIBRE,8.0 un,090216
7500435229487,Toallas Femeninas con Alas Noches Tranquilas Seca Always 8 Un,ALWAYS,8.0 un,090216
7790770601851,Toallas Femeninas Nocturna Max Nosotras 8 Un,NOSOTRAS,8.0 un,090216
7500435229494,Toallas Femeninas con Alas Noches Tranquilas Seca Always 16 Un,ALWAYS,16.0 un,090216
7790010003179,Toalla con Alas Espciales Siempre Libre 8 Un,SIEMPRE LIBRE,8.0 un,090216
7790010002677,Toallas Femeninas con Alas Adapt Plus Noche y Dia Siempre Libre 16 Un,SIEMPRE LIBRE,16.0 un,090216
7500435229609,Toallas Femeninas con Alas Triple Proteccion Dia Always 8 Un,ALWAYS,16.0 un,090216
7790010002646,Toallas Femeninas con Alas Adapt Plus Siempre Libre 16 Un,SIEMPRE LIBRE,16.0 un,090216
7790010002721,Toallas Femeninas con Alas Normal Suave Siempre Libre 16 Un,SIEMPRE LIBRE,16.0 un,090216
7790770601899,Toallas Femeninas Clasica Nosotras 16 Un,NOSOTRAS,16.0 un,090216
7794626011566,Toalla Femenina Nocturna con Alas Kotex 16 Un,KOTEX,16.0 un,090216
7790010002738,Toallas Femeninas con Alas Adapt Plus Ultrafinas Siempre Libre 16 Un,SIEMPRE LIBRE,16.0 un,090216
7790010002783,Toallas Femeninas con Alas Adapt Plus Noche y Dia Suave Siempre Libre 32 Un,SIEMPRE LIBRE,32.0 un,090216
7500435229654,Toallas Femeninas con Alas Triple Proteccion Xtra Suave Always 8 Un,ALWAYS,8.0 un,090216
7790010002707,Toallas Femeninas con Alas Adapt Plus Noche y Dia Siempre Libre 16 Un,SIEMPRE LIBRE,16.0 un,090216
7790770602070,Toallas Femeninas con Alas Normal Nuevo Centro Liquido Calipso 8 Un,CALIPSO,8.0 un,090216
7790010003186,Toalla con Alas Siempre Libre Espciales 16 Un,SIEMPRE LIBRE,16.0 un,090216
7790010002714,Toallas Femeninas con Alas Normal Suave Siempre Libre 8 Un,SIEMPRE LIBRE,8.0 un,090216
7790010002639,Toallas Femeninas con Alas Adapt Plus Siempre Libre 8 Un,SIEMPRE LIBRE,8.0 un,090216
7790770602087,Toallas Femeninas con Alas Normal con Gel Bolsita Individual Calipso 16 Un,CALIPSO,16.0 un,090216
7790010002622,Toallas Femeninas con Alas Adapt Plus Ultra Suave Siempre Libre 32 Un,SIEMPRE LIBRE,32.0 un,090216
7790940216212,Toalla Femenina Doncella Duo Pack con Alas sin Desodorante 16 Un,DONCELLA,16.0 un,090216
7790940518026,Toallas Femeninas Incontinencia Mini Doncella 8 Un,DONCELLA,8.0 un,090216
7790940518033,Toallas Femeninas con Alas Incontinencia Media Doncella 8 Un,DONCELLA,8.0 un,090216
7790940518040,Toallas Incontinencia Maxi Doncella 10 Un,DONCELLA,10.0 un,090216
7790770601882,Toallas Femeninas con Alas Clasica Suave Nosotras 8 Un,NOSOTRAS,8.0 un,090216
7790010002745,Toallas Femeninas con Alas Adapt Plus Ultrafina Siempre Libre 32 Un,SIEMPRE LIBRE,32.0 un,090216
7891010976262,Exfoliante Acne Proofing Neutrogena 100 Gr,NEUTRÓGENA,100.0 gr,090301
7798140257547,Crema Facial Antiarrugas Teatrical 100 Gr,TEATRICAL,100.0 gr,090302
7798140253372,Crema Antiarrugas Humectante Age Care Cicatricure 50 Gr,CICATRICURE,50.0 gr,090302
7509552912005,Crema Loreal Hidra Total 5 Wrinkle Expert +45 50 Ml,LOREAL,50.0 ml,090302
7509552912012,Crema Loreal Hidra Total 5 Wrinkle Expert +55 50 Ml,LOREAL,50.0 ml,090302
7798140259978,Crema Antiarrugas Aclarante Age Care Cicatricure 50 Gr,CICATRICURE,50.0 gr,090302
7798140259985,Crema Antiarrugas Reafirmante Age Care Cicatricure 50 Gr,CICATRICURE,50.0 gr,090302
7798140255024,Crema Facial Antiarrugas Cicatricure 50 Gr,CICATRICURE,50.0 gr,090302
4005900086426,Crema Facial de Dia con Q10 Fps 30 Nivea 50 Ml,NIVEA,50.0 ml,090302
7501027232311,Crema Loreal Revitalift Dermo Expert Dia Caja 50 Gr,LOREAL,50.0 gr,090302
7798140257554,Crema Facial Humectante Teatrical 100 Gr,TEATRICAL,100.0 gr,090303
4005900806161,Hidratante y Refrescante Facial con Agua de Rosas Nivea 150 Ml,NIVEA FACE,150.0 ml,090303
7899706194273,Crema Gel Hidratante Aclara Vitamina C Garnier 50 Ml,LOREAL,50.0 ml,090303
4005900938534,Gel Exfoliante Facial Purificante con Aloe Nivea 75 Ml,NIVEA,75.0 ml,090303
7891010251048,Agua Micelar Hydro Boost Neutrogena 200 Ml,NEUTRÓGENA,200.0 ml,090303
7798140257530,Crema Facial Aclaradora Teatrical 100 Gr,TEATRICAL,100.0 gr,090303
7509552844047,Crema Facial Hidratante Anti-Manchas Vitamina C Garnier 50 Ml,LOREAL,50.0 ml,090303
7891010245214,Gel Limpieza Facial Purified Skin Neutrogena Pom 150 Gr,NEUTRÓGENA,150.0 gr,090303
7509552905137,Crema Loreal Hidra-Total 5 Humectante Anti-Arruga Caja 50 Ml,LOREAL,50.0 ml,090303
7501056325442,Crema Humectante Pond's 50 Gr,POND'S,50.0 gr,090303
7501056330309,Crema Facial Aclaradora Piel Normal Grasa Pond's 100 Gr,POND'S,100.0 gr,090303
3600542326414,Agua Micelar Rosas Garnier 400 Cc,GARNIER,400.0 cc,090303
7793742005039,Leche de Limpieza Facial Activa Dermaglos 200 Ml,DERMAGLÓS,200.0 ml,090303
7793742007576,Crema Dermaglos Facial Nutritiva Pote 70 Gr,DERMAGLÓS,70.0 gr,090303
7793742007583,Gel Dermaglos Facial Limpieza Purificante Pomo 150 Gr,DERMAGLÓS,150.0 gr,090303
7509552849646,Gel de Limpieza con Acido Hialuronico L Oreal 150 Ml,L ´OREAL,150.0 ml,090303
7798140257578,Crema Facial Antiarruga Teatrical 200 Gr,TEATRICAL,200.0 gr,090303
7798140257592,Crema Facial Humectante Restage Teatrical 200 Gr,TEATRICAL,200.0 gr,090303
7891010099725,Limpieza Facial Neutrogena 80 Gr,NEUTRÓGENA,80.0 gr,090303
4005900713636,Crema Facial Noche Cellular Expert Nivea 50 Cc,NIVEA,50.0 cc,090303
4005900713629,Crema Facial Dia Cellular Expert Lift Nivea 50 Cc,NIVEA,50.0 cc,090303
7891010253844,Crema Hidratante Mate 3 en 1 Neutrogena 100 Gr,NEUTRÓGENA,100.0 gr,090303
7798008966482,Serum Facial Hidratante Glow Iwoo 30 Ml,IWOO,30.0 ml,090303
7798008966505,Crema Facial Hidratante Iwoo 50 Ml,IWOO,50.0 ml,090303
7798140250371,Crema Beauty Care Cicatricure 50 Gr,CICATRICURE,50.0 gr,090303
7798140257561,Crema Facial Aclaradora Teatrical 200 Gr,TEATRICAL,200.0 gr,090303
7509552796131,Crema Gel Facial Acido Hialuronico Revitalift L Oreal 50 Ml,L´OREAL,50.0 ml,090303
7509552905366,Crema Facial Hidratotal 5 Matificante Loreal Paris 50 Ml,LOREAL,50.0 ml,090303
7509552911992,Crema Loreal Hidra Total 5 Wrinkle Expert +35 50 Ml,LOREAL,50.0 ml,090303
7793742002922,Crema Dermaglos Emulsion Hidrata Profunda Dia Caja 70 Ml,DERMAGLÓS,70.0 ml,090303
7793742007897,Crema Dermaglos Facial Pote 50 Gr,DERMAGLÓS,50.0 gr,090303
4005900773821,Agua Micelar Bifasica Rose Care Nivea Face 400 Ml,NIVEA FACE,400.0 ml,090304
7509552455557,Desmaquillante Agua Micelar Todo en 1 Botella Garnier 400 Ml,GARNIER,400.0 ml,090304
4005900773838,Gel Micelar Limpiador Rose Care Nivea 150 Ml,NIVEA FACE,150.0 ml,090304
4005900359261,Agua Micelar Piel Normal Nivea 200 Ml,NIVEA,200.0 ml,090304
7501054541172,Agua Micelar Piel Normal Nivea 400 Ml,NIVEA,400.0 ml,090304
7501056324889,Desmaquillador Crema C Pond's Pote 100 Gr,POND'S,100.0 gr,090304
7509552800098,Desmaquillante Agua Micelar Bifasica Loreal Botella 200 Ml,LOREAL,200.0 ml,090304
7790773008473,Toallitas Desmaquillante con Aloe Te y Pepino Q Soft 25 Un,Q SOFT,25.0 un,090304
7891010245160,Agua Micelar Purified Skin Neutrogena 200 Cc,NEUTRÓGENA,200.0 cc,090304
7790773008435,Toallas Desmaquillante Agua Micelar Q-Soft 25 Un,Q SOFT,25.0 un,090304
7791274197710,Toallas Desmaquillantes Algabo 25 Un,ALGABO,25.0 un,090304
7793742007415,Agua Micelar Facial Dermaglos 200 Ml,DERMAGLÓS,200.0 ml,090304
7793742007934,Gel de Limpieza Facial Dermaglos 150 Gr,DERMAGLÓS,150.0 gr,090304
4005900773845,Leche y Tonico Micelar Rose Care Nivea 200 Ml,NIVEA FACE,200.0 ml,090304
7509552798005,Gel de Limpiaza Anti Brillo Revitalife 150 Ml,LOREAL,150.0 ml,090304
7509552842319,Agua Micelar con Vitamina C SkinActive Garnier 400 Ml,LOREAL,400.0 ml,090304
7702018072477,Repuesto Rasuradora Recargable Venus Gillette 2 Un,GILLETTE,2.0 un,090305
7500435178570,Maquina de Afeitar Descartable Cuerpo Gillete 2 Un,GILLETTE,2.0 un,090305
7702018001071,Maquina Afeitar Mach 3 Gillette 1 Un,GILLETTE,1.0 un,090305
7702018983872,Rasuradora Desechable Men Prestobarba3 Ice Gillette 2 Un,GILLETTE,2.0 un,090305
7500435211635,Repuesto Mach3 Carbono Gillette 4 Un,GILLETTE,4.0 un,090305
7702018072392,Rasuradora Desechable Simply Venus Gillette 2 Un,GILLETTE,2.0 un,090305
7702018072217,Maquina Afeitar Woman Gillette 2 Un,GILLETTE,2.0 un,090305
7506339315905,Repuesto o Rasuradora Femenina Venus Divine Sensitive Gillette 2 Un,GILLETTE,2.0 un,090305
7500435219334,Maquina de Afeitar Carbono Mach3 Gillette 1 Un,MACH3,1.0 un,090305
7500435219648,Espuma de Afeitar Sensitive Skin Gillette 175 Gr,GILLETTE,175.0 gr,090305
7500435225366,Repuesto Maquina Afeitar Carbono Gillette Mach 3 2 Un,GILLETTE ,2.0 un,090305
7506339337525,Maquina Afeitar Masculina Prestobarba Sense Care Gillette 2 Un,GILLETTE,2.0 un,090305
7500435224604,Espuma de Afeitar Regular Gillette 312 Gr,GILLETTE,312.0 gr,090305
7500435219655,Espuma de Afeitar Sensitive Skin Gillette 312 Gr,GILLETTE,312.0 gr,090305
7702018983902,Maquina Afeitar Prestobarba 3 Ice Gillette Blister 4 Un,GILLETTE,4.0 un,090305
7500435173100,Crema Afeitar Protectora Suave y Lisa Venus 150 Ml,VENUS,150.0 ml,090305
7702018874729,Maquina de Afeitar Prestobarba 3 Gillette 2 Un,GILLETTE,2.0 un,090305
7702018072408,Maquina Simply Venus3 Gillette 4 Un,GILLETTE,4.0 un,090305
7500435204026,Maquina Afeitar Especial Area Intima Venus 1 Un,VENUS,1.0 un,090305
7702018053469,Espuma de Afeitar Menthol Gillette 175 Gr,GILLETTE,175.0 gr,090305
4005808229123,Gel de Afeitar Nivea Sensitive 200 Ml,NIVEA,200.0 ml,090305
7500435173223,Crema de Afeitar Cara y Cuerpo Gillette 150 Ml,GILLETTE,150.0 ml,090305
7702018874750,Afeitadora Prestobarba 3 Gillette 4 Un,GILLETTE,4.0 un,090305
7500435178587,Maquina de Afeitar Desechable Corpo Cuerpo Gillette 4 Un,GILLETTE,4.0 un,090305
7702018037865,Repuesto Rasuradora Prestobarba Mach3 Sensitive 2 Un,GILLETTE,2.0 un,090305
7702018037896,Repuesto Rasuradora Recargable Mach3 Sensitive 4 Un,GILLETTE,4.0 un,090305
8715200813061,Locion para despues de Afeitar Nivea Sensitive Balsamo 100 Ml,NIVEA,100.0 ml,090305
7500435144223,Maquina Desechable Mujer Venus Simp3 Sensitive 2 Un,VENUS,2.0 un,090305
7500435219662,Espuma de Afeitar Menthol Gillette 312 Gr,GILLETTE,312.0 gr,090305
7506339315486,Rasuradora Femenina Venus Divine Sensitive Gillette 1 Un,GILLETTE,1.0 un,090305
7702018874781,Rasuradora Desechable Femenina Prestobarba3 Gillette 2 Un,GILLETTE,2.0 un,090305
7506339337532,Rasuradora Male Prestobarba Sense Care Gillette 4 Un,GILLETTE,4.0 un,090305
7500435144230,Maquina Desechable Mujer Venus Simp3 Sensitive 4 Un,VENUS,4.0 un,090305
7500435125239,Maquina de Afeitar Prestobarba 3 Cooling 8 Un,PRESTOBARBA,8.0 un,090305
7500435160674,Maquina de Afeitar Descartables Gillette 5 Un,GILLETTE,5.0 un,090305
8412300813006,Locion para despues de Afeitar Nivea Balsamo 100 Ml,NIVEA,100.0 ml,090305
7501843502926,Maquina de Afeitar Mujer Clic Sensitive Soleil Bic 6 Un,BIC,6.0 un,090305
7506339337549,Maquina Afeitar Prestobarba 3 Sense Care Gillette 8 Un,GILLETTE,8.0 un,090305
7506339389500,Maquina de Afeitar Cabeza Fija Gillette Prestobarba UltraGrip 10 Un,GILLETTE,10.0 un,090305
7891024183083,Hilo Dental Fluor Menta Colgate Total 25 Mt,COLGATE,25.0 mt,090401
7891024183120,Hilo Dental Colgate Lleve 2 Pague 1,COLGATE,2.0 un,090401
7794640171758,Adhesivo Crema sin Sabor Ultra Corega 70 Gr,COREGA,70.0 gr,090401
7794640171741,Adhesivo Dental sin Sabor Crema Ultra Corega 40 Gr,COREGA,40.0 gr,090401
7794640171765,Adhesivo para Protesis Dentales en Crema de Menta Ultra Corega 70 Gr,COREGA,70.0 gr,090401
7891024183182,Hilo Dental Total Colgate 25 Mt,COLGATE,25.0 mt,090401
7794640171703,Crema Dental Corega Ultra Adhesiva Menta 40 Gr,COREGA,40.0 gr,090401
7509546075242,Cepillo Dental Super Flexi Suave Colgate 2 Un,COLGATE,2.0 un,090402
5900273001566,Cepillo Dental Colgate Extra Clean 1 Un,COLGATE,1.0 un,090402
7591083011098,Cepillo Dental Infantil Extra Suave Colgate 1 Un,COLGATE,1.0 un,090402
7509546073453,Cepillo Colgate Kids 5 2 Un,COLGATE,2.0 un,090402
7702010631207,Cepillo Dental Triple Accion Colgate 2 Un,COLGATE,2.0 un,090402
7798142356385,Cepillo Dental Classic 311 Gum 2 Un,GUM,2.0 un,090402
7798142356392,Cepillo Dental Classic 411 Gum 2 Un,GUM,2.0 un,090402
7891024116128,Cepillo Dental Colgate 1 Un,COLGATE,1.0 un,090402
7753442000390,Cepillo Dental Kolynos Master Plus 1 Un,KOLYNOS,1.0 un,090402
7793100151224,Cepillo Dr Rabbit Colgate 1 Un,COLGATE,1.0 un,090402
7794640172984,Cepillo Dental Repara y Protege Sensodyne 2 Un,SENSODYNE,2.0 un,090402
3014260019723,Cepillo Dental Kids Mickey Oral B 1 Un,ORAL B,1.0 un,090402
7501086453955,Cepillo Indicador Value Pack Oral B 2 Un,ORAL B,2.0 un,090402
7501086494262,Cepillo Dental Cerdas Indicadoras de Cambio Oral B 1 Un,ORAL B,1.0 un,090402
7702010630422,Cepillo Dental Extra Clean Colgate 2 Un,COLGATE,2.0 un,090402
7794640171697,Cepillo Dental Medium Multi Protection Sensodyne Blister 1 Un,SENSODYNE,1.0 un,090402
7891024131183,Enjuague Bucal Menta Fresca Colgate 500 Ml,COLGATE,500.0 ml,090403
7891024136409,Enjuague Bucal Plax Menta con Fluor Colgate 250 Ml,COLGATE,250.0 ml,090403
7891024030806,Enjuague Bucal Minions Colgate Plax Kids 250 Ml,COLGATE,250.0 ml,090403
7891010255312,Enjuague Bucal Freshburst Frescura Intensa Listerine 500 Ml,LISTERINE,500.0 ml,090403
7891010255350,Enjuague Bucal Cool Mint Frescura Suave Listerine 250 Ml,LISTERINE,250.0 ml,090403
7509546686622,Enjuague Bucal Carbon Total 12 Colgate 250 Cc,COLGATE,250.0 cc,090403
7891010255374,Enjuague Bucal Cuidado Total Frescura Intensa Listerine 250 Ml,LISTERINE,250.0 ml,090403
7891024130940,Enjuague Bucal Soft Mint Plax 250 Ml,COLGATE,250.0 ml,090403
7509546686615,Enjuague Bucal Carbon Total 12 Colgate 500 Cc,COLGATE,500.0 cc,090403
7509546679617,Enjuague Bucal Fresh Mint Plax Colgate 750 Ml,COLGATE,750.0 ml,090403
7891010255244,Enjuague Bucal Cool Mint Listerine 250 Ml,LISTERINE,250.0 ml,090403
7891010255381,Enjuague Bucal Cuidado Total Frescura Suave Listerine 500 Ml,LISTERINE,500.0 ml,090403
7891010255282,Enjuague Bucal Antisarro Suave Listerine 250 Ml,LISTERINE,250.0 ml,090403
7509546686509,Crema Dental Triple Accion Colgate 180 Gr,COLGATE,180.0 gr,090404
7793100111891,Crema Dental Ultra Blanco Colgate 90 Gr,COLGATE,90.0 gr,090404
7891024034095,Crema Dental Colgate Kids Frutilla 50 Gr,COLGATE,50.0 gr,090404
7509546686042,Crema Dental Carbon Act Total 12 Colgate 90 Gr,COLGATE,90.0 gr,090404
7896015520045,Crema Dental Blanqueadora Sensodyne Extra Fresh 90 Gr,SENSODYNE,90.0 gr,090404
7509546686523,Crema Dental Triple Accion Colgate 90 Gr,COLGATE,90.0 gr,090404
7798142351205,Crema Dental Paw Patrol Gum 100 Gr,GUM,100.0 gr,090404
7509546687292,Crema Dental Doble Proteccion Odol 90 Gr,ODOL,90.0 gr,090404
7891024135020,Crema Dental Total 12 Whitening Colgate 90 Gr,COLGATE,90.0 gr,090404
7891024005064,Crema Dental Colgate Luminuos White 140 Gr,COLGATE,140.0 gr,090404
7891024123027,Crema Dental Luminous White Colgate 90 Gr,COLGATE,90.0 gr,090404
7509546654034,Crema Dental Total 12 Anti Sarro Colgate 90 Gr,COLGATE,90.0 gr,090404
7500435150248,Pasta Dental Extra Blancura Oral B 70 Gr,ORAL B,70.0 gr,090404
7506295388487,Crema Dental White 3D Oral B 70 Gr,ORAL B,70.0 gr,090404
7891037744257,Gel Dental Menthol Paradise Close Up 90 Gr,CLOSE UP,90.0 gr,090404
7509546056098,Crema Dental Triple Accion Colgate 103 Gr,COLGATE,103.0 gr,090404
7509546066776,Crema Dental Minions + 6 Años Colgate 75 Gr,COLGATE,75.0 gr,090404
7896015591106,Pasta Dental Sensodyne Limpieza profunda 90 Gr,SENSODYNE,90.0 gr,090404
7793100120275,Crema Dental Proteccion Refrescante Kolynos 90 Gr,KOLYNOS,90.0 gr,090404
7793100120282,Crema Dental Proteccion Refrescante Kolynos 180 Gr,KOLYNOS,180.0 gr,090404
7500435127363,Dentifrico Mickey Oral B 50 Gr,ORAL B,50.0 gr,090404
7896009419294,Crema Dental Sensodyne MultiProteccion 90 Gr,SENSODYNE,90.0 gr,090404
7509546651057,Crema Dental Charcoal Luminous White Colgate 90 Gr,COLGATE,90.0 gr,090404
7896009419324,Crema Dental Sensodyne Original 90 Gr,SENSODYNE,90.0 gr,090404
7891024131909,Crema Dental Colgate Triple Accion 50 Gr,COLGATE,50.0 gr,090404
7891024123362,Crema Dental Max White Crystal Mint Colgate 180 Gr,COLGATE,180.0 gr,090404
7509546668055,Crema Dental Total 12 Encias Reforzadas Colgate 90 Gr,COLGATE,90.0 gr,090404
7798142350222,Crema Dental Blanqueadora con Fluor Gum 100 Gr,GUM,100.0 gr,090404
7896009498091,Crema Dental Complete Protection Sensodyne 90 Gr,SENSODYNE,90.0 gr,090404
7896015527457,Crema Dental en Crema Parodontax con Fluor 90 Gr,PARODONTAX,90.0 gr,090404
5054563054975,Crema Dental Complete Protection Parodontax Caja 126 Gr,PARODONTAX,126.0 gr,090404
7509546667577,Crema Dental Luminous White Lovers Colgate 70 Gr,COLGATE,70.0 gr,090404
7891024124628,Crema Dental Sens Proalivio Blanqueador Colgate 110 Gr,COLGATE,110.0 gr,090404
7896009498589,Crema Dental Sensibilidad y Blanqueador Sensodyne 100 Gr,SENSODYNE,100.0 gr,090404
7896015527433,Crema Dental Fluor Parodontax 50 Gr,PARODONTAX,50.0 gr,090404
7790139101053,Alcohol Etilico al 70% Spray Bialcohol 100 Ml,BIALCOHOL,100.0 ml,090501
7790139003807,Alcohol Etilico Bialcohol 500 Cc,PORTA,500.0 cc,090501
7790139000400,Alcohol Etilico Bialcohol 1 Lt,PORTA,1.0 lt,090501
7790139003654,Alcohol en Gel Bialcohol Porta 250 Cc,PORTA,250.0 cc,090501
7790139000288,Alcohol en Gel Bialcohol Porta Neutro 60 Gr,PORTA,60.0 gr,090501
7702003010781,Apositos Transpiel Curitas 20 Un,CURITAS,20.0 un,090503
7702003010736,Apositos Tela Elastica Flex Curitas 20 Un,CURITAS,20.0 un,090503
7501054542896,Apositos Frozen Curitas 20 Un,CURITAS,20.0 un,090503
7702003010774,Apositos Transpiel Curitas 10 Un,CURITAS,10.0 un,090503
7702003010743,Apositos Tela Elastica Flex Curitas 8 Un,CURITAS,8.0 un,090503
7501054550044,Apositos Marvel Curitas 20 Un,CURITAS,20.0 un,090503
4005900942791,Aposito Flexible Xl Curitas 10 Un,CURITAS,10.0 un,090503
7501054550563,Aposito Transpiel Surtido Curitas 40 Un,CURITAS,40.0 un,090503
7791519702105,Preservativo Skyn Prime 6 Un,PRIME,6.0 un,090504
7791519704642,Preservativo Texturado Prime 6 Un,PRIME,6.0 un,090504
7798171946502,Preservativos Texturado Maxx Pack 6 Un,MAXX,6.0 un,090504
7791519704659,Preservativo Super Fino Prime 6 Un,PRIME,6.0 un,090504
7791519704635,Preservativo Tachas Prime 6 Un,PRIME,6.0 un,090504
7791519704604,Preservativos Ultra Fino 6 + 3 Geles de Regalo Caja 1 Un,PRIME,1.0 un,090504
7791014121906,Preservativos Ultra Fino Tulipan 6 Un,TULIPÁN,6.0 un,090504
7791014001536,Preservativos Super Finos Tulipan 6 Un,TULIPÁN,6.0 un,090504
7791014001512,Preservativos Clasicos Tulipan 6 Un,TULIPÁN,6.0 un,090504
7798171946496,Preservativos Super Lubricado Maxx Pack 6 Un,MAXX,6.0 un,090504
7790940515063,Protectores Mamarios Anatomicos con Gel Doncella 24 Un,DONCELLA,24.0 un,090505
7896007552955,Ropa Interior P/M Classic Plenitud 8 Un,PLENITUD CLASSIC,8.0 un,090601
7896007552962,Ropa Interior G/XG Classic Plenitud 8 Un,PLENITUD CLASSIC,8.0 un,090601
7702026174149,Protector Incontinencias Pants Medium Tena 8 Un,TENA,8.0 un,090601
7702026174156,Protector Incontinencias Pants Large Tena 8 Un,TENA,8.0 un,090601
7790940410252,Pañal Adulto Anatomico Ultra XG Nonisec 8 Un,NONISEC,8.0 un,090601
7794626013713,Pañal Adulto Talle G Control Plenitud 8 Un,PLENITUD,8.0 un,090601
7790940410245,Pañal Adulto Anatomico Grande Nonisec Ultra 8 Un,NONISEC,8.0 un,090601
4058075780477,Lampara Led Galponra 20W Fria Ledvance 1 Un,LEDVANCE,1.0 un,70
4058075776456,Lampara Led Classic 7W Calida Osram 1 Un,OSRAM,1.0 un,70
4058075776432,Lampara Led Clasica 5.5W Fria E27 Osram 1 Un,OSRAM,1.0 un,70
4058075776593,Lampara Led Classi Fria 14W Value Osram 1 Un,OSRAM,1.0 un,70
4058075776531,Lampara Led Clasica 12W Ledvance 1 Un,LEDVANCE,1.0 un,70
4058075776401,"Lampara Led Cla 40 5,5W Ledvance 1 Un",LEDVANCE,1.0 un,70
4058075776555,Lampara Led 12W/865 Fria Osram 1 Un,OSRAM,1.0 un,70
4058075776579,Lampara Led Classic Calida 14W 220V Osram 1 Un,OSRAM,1.0 un,70
7791813888468,Gaseosa Pepsi  Botella 2 L,PEPSI,2 l,bebidas
7791813828464,Gaseosa Pepsi Black 2 L,PEPSI,2 l,bebidas
7792798014835,Cerveza Quilmes Clasica 710cc,QUILMES,710cc,bebidas
7792798014873,Cerveza Sin Alcohol 330 Cc Corona,CORONA,330 cc,bebidas
7792798015061,Cerveza Rubia X 710 Cc Brahma,BRAHMA,710 cc,bebidas
7792798013470,Cerveza Stella Artois Sin Alcohol 330 Ml,STELLA ARTOIS,330 ml,bebidas
7793147574093,Cerveza Cero X 473 Cc Heineken,HEINEKEN,473 cc,bebidas
7793147573737,Cerveza Imperial Rubia 1 L,IMPERIAL,1 l,bebidas
7791813434412,Gaseosa 7 Up Sin Azucar 1.5lt,7 UP,1.5lt,bebidas
7791813828419,Gaseosa Pepsi  Black 1.5lt,PEPSI,1.5lt,bebidas
7791813434450,Gaseosa 7 Up Sin Azucar 2.25lt,7 UP,2.25lt,bebidas
7790950147926,Aperitivo Sin Alcohol X 473 Cc Gancia,GANCIA,473 cc,bebidas
7790314080159,Vino Estancia Mendoza Malbec 750cc,ESTANCIA MENDOZA,750cc,bebidas
7790580143008,Jugo En Polvo Arcor Naranja Dulce X 15 Gr,ARCOR,15 gr,bebidas
7791843009116,Vino Nampe Malbec 1125cc,NAMPE,1125cc,bebidas
7791813444411,Gaseosa 7up Vintage 1.5lt,7 UP,1.5lt,bebidas
7791813888413,Gaseosa Pepsi Vintage 1.5lt,PEPSI,1.5lt,bebidas
7790314080203,Vino Chardonnay Dulce Chening Estancia Mendoza,ESTANCIA MENDOZA,Vino Chardonnay Dulce Chening Estancia Mendoza,bebidas
7790580143237,Jugo En Polvo Arcor Naranja X 15 Gr,ARCOR,15 gr,bebidas
7790975204062,Vino Latitud 33 Malbec 750 Cc,LATITUD 33,750 cc,bebidas
7793147573546,Cerveza Amstel Lager 473 Cc,AMSTEL,473 cc,bebidas
7790314063824,Vino Toro Clasico Tinto 1lt Brk,TORO,1lt,bebidas
7791200200781,Aperitivo Campari Bitter 750 Cc,CAMPARI,750 cc,bebidas
7792798015023,Cerveza Patagonia Lager Del Sur 730cc,PATAGONIA,730cc,bebidas
7790168904502,Vino Colon Selecto Dulce Fresco Blanco 750cc,COLON,750cc,bebidas
7791200200552,Vermouth Cinzano Rosso 950 Ml,CINZANO,950 ml,bebidas
