ID/EAN,NOMBRE,MARCA,PRESENTACION,ID_CATEGORIA
"7791813888413","Gaseosa Pepsi Vintage Botella 1.5 l","Pepsi","1.5 l",""
"7791337007956","Bebida a Base de Almendras Silk Sabor Chocolate 1 lt.","Silk","1 lt",""
"7791337007932","Leche de Almendras Silk de Coco Sin Azúcar Tetra 1 lt.","Silk","1 lt",""
"7791337007925","Leche de Almendras Silk de Coco Tetra 1 lt.","Silk","1 lt",""
"7791337007949","Leche de Almendras Silk de Vainilla Tetra 1 lt.","Silk","1 lt",""
"7791337007901","Leche de Almendras Silk Endulzada Tetra 1 lt.","Silk","1 lt",""
"7791337007918","Leche de Almendras Silk Sin Azúcar Tetra 1 lt.","Silk","1 lt",""
"7791337008052","Yogur Bebible Deslactosado La Serenísima Sabor Frutilla en Sachet 900 g.","La Serenisima","900 g",""
"7791337008069","Yogur Bebible Deslactosado La Serenísima Sabor Vainilla en Sachet 900 g.","La Serenisima","900 g",""
"7791337010475","Sachet Yogur Descremado Frutilla la Serenísima Nutrición Activa 900 Grs","La Serenisima","900 Grs",""
"7791337010468","Sachet Yogur Descremado Sabor Vainilla la Serenísima Nutrición Activa 900 Grs","La Serenisima","900 Grs",""
"7791337008380","Yogur Bebible Descremado La Serenísima Sabor Frutilla en Sachet 900 cc.","La Serenisima","900 cc",""
"7791337008366","Yogur Bebible Descremado La Serenísima Sabor Vainilla en Sachet 900 cc.","La Serenisima","900 cc",""
"7791337008342","Yogur Bebible Entero La Serenísima Sabor Durazno en Sachet 900 g.","La Serenisima","900 g",""
"7791337008335","Yogur Bebible Entero La Serenísima Sabor Frutilla en Sachet 900 g.","La Serenisima","900 g",""
"7791337008311","Yogur Bebible Entero La Serenísima Sabor Vainilla en Sachet 900 g.","La Serenisima","900 g",""
"7791337010376","Yogur Bebible la Serenísima Sabor Durazno en Sachet 900 Grs","La Serenisima","900 Grs",""
"7791337010215","Yogur Bebible la Serenísima Sabor Frutilla en Sachet 900 Grs","La Serenisima","900 Grs",""
"7791337010369","Yogur Bebible la Serenísima Sabor Vainilla en Sachet 900 Grs","La Serenisima","900 Grs",""
"7791337061422","Queso Crema La Serenísima Clásica en Pote 290 g.","La Serenisima","290 g",""
"7791337061439","Queso Crema La Serenísima Light en Pote 290 g.","La Serenisima","290 g",""
"7792798013975","Cerveza Blanca Stella Artois en Lata 710 cc.","Stella Artois","710 cc",""
"7792798013982","Cerveza Blanca Stella Artois en Lata X4 710 cc.","Stella Artois","710 cc",""
"7791337061361","Queso Crema Casancrem Clásico 290 g.","Casancrem","290 g",""
"7791337061385","Queso Crema Casancrem Light 290 g.","Casancrem","290 g",""
"7791337060944","Queso Crema Light Casancrem Sin Sal en Pote 290 g.","Casancrem","290 g",""
"7791337007376","Ls Yogur Batido La Serenisima Entero Durazno 120 xg","LS","",""
"7791337007369","Ls Yogur Batido La Serenisima Entero Frutilla 120 xg","LS","",""
"7791337007437","Ls Yogur Firme La Serenisima Entero Frutilla 120 xg","LS","",""
"7791337007420","Ls Yogur Firme La Serenisima Entero Vainilla 120 xg","LS","",""
"7791337007406","Lsclasico Yogur Descremado Batido La Serenisima Clasico Frutilla 120 g","LSCLASICO","120 g",""
"7791337007413","Lsclasico Yogur Descremado Batido La Serenisima Clasico Vainilla 120 g","LSCLASICO","120 g",""
"7791337007772","Lsclasico Yogur Descremado Firme La Serenisima Clasico Frutilla 190 g","LSCLASICO","190 g",""
"7791337007765","Lsclasico Yogur Descremado Firme La Serenisima Clasico Vainilla 190 g","LSCLASICO","190 g",""
"7791337007451","Lsclasico Yogur Firme La Serenisima Clasico Frutilla 190 g","LSCLASICO","190 g",""
"7791337007444","Lsclasico Yogur Firme La Serenisima Clasico Vainilla 190 g","LSCLASICO","190 g",""
"7791337007352","Lsclasico Yogur La Serenisima Entero Batido Vainilla 120 g","LSCLASICO","120 g",""
"7791337008267","Yogur Bebible Entero Yogurisimo de Banana en Sachet 900 cc.","Yogurisimo","900 cc",""
"7791337008229","Yogur Bebible Entero Yogurisimo de Frutilla en Sachet 900 cc.","Yogurisimo","900 cc",""
"7791337008243","Yogur Bebible Entero Yogurisimo de Vainilla en Sachet 900 cc.","Yogurisimo","900 cc",""
"7791337007383","Ls Yogur Batido La Serenisima Confites Chocolate 164 g","LS","164 g",""
"7791337008236","Yogur Batido Descremado Gran Compra de Frutilla 120 g.","Gran Compra","120 g",""
"7791337008212","Yogur Batido Descremado Gran Compra de Vainilla 120 g.","Gran Compra","120 g",""
"7791337007161","Yogur Descremado Gran Compra Sabor Frutilla 120 g.","Gran Compra","120 g",""
"7791337007178","Yogur Descremado Gran Compra Sabor Vainilla 120 g.","Gran Compra","120 g",""
"7622201736033","Galletitas Cracker Cereal Cerealitas Clásicas 212 g","Cerealitas","212 g",""
"7790742665027","Bebida Lactea La Serenísima Frutilla Sachet 900 cc.","LS","900 cc",""
"7790742665010","Bebida Lactea La Serenísima Vainilla Sachet 900 cc.","LS","900 cc",""
"7790742661333","B.Lactea Cookies La Serenisima Sachet 900 ml","La Serenisima","900 ml",""
"7790742661067","B.Lactea Ddl La Serenisima Sachet 900 ml","La Serenisima","900 ml",""
"7792798007387","Cerveza Rubia Quilmes Clásica 1 L Botella Retornable (hasta 12 unidades)","Quilmes","1 L",""
"7791905003861","Jabón Líquido Para Ropa Netic 800 g.","Netic","800 g",""
"7790742363107","Leche Uat 1 la Serenisima 1 l","La Serenisima","1 l",""
"7790742363008","Leche Uat 3 la Serenisima 1 l","La Serenisima","1 l",""
"7790580146115","Puré de Tomate Arcor Brik 520 g.","Arcor","520 g",""
"7793704000911","Yerba Mate Playadito Suave X500gr","Playadito","500gr",""
"7790742872661","Bebida Lactea Sense Capuccino 200 ml","Sense","200 ml",""
"7790742172105","Leche Descremada Protein Chocolate 1 l La Serenisima","La Serenisima","1 l",""
"7790742333605","Leche Uat La Serenisima Zerolact 1 botl","La Serenisima","",""
"7791337007390","Ls Yogur Batido La Serenisima Entero Cereales 159 g","LS","159 g",""
"7790742172204","Sense Proteina Cacao La Serenisima Uat 200 ml","Sense","200 ml",""
"7791337007697","Yogur Descremado La Serenísima Con Cereales 157 g.","La Serenisima","157 g",""
"7793940054006","Manteca La Serenísima 200 gr.","La Serenisima","200 gr",""
"7790742625304","Dulce De Leche Clasico La Serenisima 400 Gr","La Serenisima","400 Gr",""
"7792798014255","Cerveza Blanca Brahma Musica en Lata 473 cc.","Brahma","473 cc",""
"7792798007493","Cerveza Brahma Chopp Rubia 1lt Retornable (hasta 12 unidades)","Brahma","1lt",""
"7792798014262","Cerveza Brahma Musica 1 lt Ret.","Brahma","1 lt",""
"7792798014279","Cerveza Brahma Musica 2023 Sixpack 473 cc","Brahma","473 cc",""
"7792798005970","Cerveza Rubia Brahma 6 x 473 cc.","Brahma","473 cc",""
"7792798005888","Cerveza Rubia Brahma Chopp 473 Ml Lata","Brahma","473 Ml",""
"7622201806552","Galletitas Oreo Golden S/Colorantes X118g","Oreo","118g",""
"7791905001393","Jabón Líquido Para Ropa Querubín Premium 800 ml.","Querubin","800 ml",""
"7795742084359","Mir Cerveza Brahma Chopp 473 xml","Mir","",""
"7790742223203","Queso Rallado La Serenisima 175 Gr","La Serenisima","175 Gr",""
"7791337009967","Yogur Griego Cereal Azucarado x 166 grs Yogurisimo","Yogurisimo","166 grs",""
"7791337010093","Yogur Griego Cereal Granola x 168 grs Yogurisimo","Yogurisimo","168 grs",""
"7791813777052","7 Up 7up Lima Limón 2.25l","7 Up","2.25l",""
"7792798014835","Cerveza Quilmes Clasica 710 cc","Quilmes","710 cc",""
"7790040872202","Galletitas De Agua Traviata 303 Gr","Traviata","303 Gr",""
"7791813434450","Gaseosa 7 Up Sin Azucar 225 .lt","7 Up","",""
"7792798014842","Mir Cerveza Quilmes Clasica 710 x 4","Mir","",""
"7791813444459","Seven Up Gaseosa 7 Up Botella 2,25 Lt.","Seven Up","2,25 Lt",""
"7792798014972","Cerveza Origen Golden x 1 Lts Retornable Andes","Andes","",""
"7792798003709","Cerveza Rubia Corona 330 cc.","Corona","330 cc",""
"7790742625205","Dulce De Leche Colonial La Serenisima 400 Gr","La Serenisima","400 Gr",""
"7790742321701","Finlandia Clasico La Serensima 180 Gr","Finlandia","180 Gr",""
"7790742324009","Queso La Serenisima Finlandia Reducido en Calorías 180 g","Finlandia","180 g",""
"7790742321800","Queso Ls Finlandia Light Pote 180gr","Finlandia","180gr",""
"7790742373205","Finlandia Clasico La Serensima 290 Gr","Finlandia","290 Gr",""
"7790742373809","Queso La Serenisima Cremon Light Pote 280gr","La Serenisima","280gr",""
"7790742373908","Queso La Serenisima Cremon Original Pote 280gr","La Serenisima","280gr",""
"7790742324108","Queso La Serenisima Finlandia Reducido en Calorías 290 g","Finlandia","290 g",""
"7790742373304","Queso Untable Finlandia 290 gr","Finlandia","290 gr",""
"7791813828464","Gaseosa Cola Black Pepsi 2 lt","Pepsi","2 lt",""
"7791813888468","Gaseosa Cola Pepsi Regular 70 K Pet 2 lts.","Pepsi","",""
"7791813422006","Gaseosa Pepsi Black Sin Azúcar 2 l","Pepsi","2 l",""
"7792798003716","Cerveza Corona 710 cc","Corona","710 cc",""
"7501064106859","Cerveza Rubia Corona 710 Ml Botella Descartable","Corona","710 Ml",""
"7790742141101","Crema de Leche La Serenísima 330 cc.","La Serenisima","330 cc",""
"7790742142009","Crema de Leche La Serenísima Zero Lactoza Tetra 200 g.","La Serenisima","200 g",""
"7622201735906","Galletitas Dulces Con Chips de Chocolate Pepitos 119 g","Pepitos","119 g",""
"7790742011701","La Serenisima Crema Uat Ls Batir 200 tetratopml","La Serenisima","",""
"7790742141705","La Serenisima Crema Uat Ls Culinaria 330 tetratopml","La Serenisima","",""
"7793940052002","Manteca La Serenísima Extra 100 g.","La Serenisima","100 g",""
"7798164602606","Salchicha Granja Iris x 6 un","Granja Iris","",""
"7798054013697","Cerveza Rubia 361 710 Ml.","361","710 Ml",""
"7790742326300","Queso Untable La Serenísima Sabor Salame en Pote 180 grs","La Serenisima","180 grs",""
"7790742326409","Sabores La Serenisima Queso Untable Sabores Fontina 180 gr La Serenísima","Sabores La Serenisima","180 gr",""
"7790742326607","Sabores La Serenisima Queso Untable Sabores Jamon 180 gr La Serenísima","Sabores La Serenisima","180 gr",""
"7790742340900","Bebida Vegetal La Serenisima Coco - 1 l","La Serenisima","1 l",""
"7790742340108","La Serenisima 100vegetal Almendra 1l","La Serenisima","1l",""
"7790742340306","La Serenisima 100vegetal Almendra Sin Azúcar 1l","La Serenisima","1l",""
"7790742223005","Queso Rallado La Serenisima 70 Gr","La Serenisima","70 Gr",""
"7790787960514","Yogur Bebible Parcialmente Descremado de Frutilla Ilolay en Sachet 900 g.","Ilolay","900 g",""
"7790742223104","Queso Rallado La Serenisima 130 Gr","La Serenisima","130 Gr",""
"7791019170305","3 Arroyos Redonditos de Chocolate Tres Arroyos 210 gr.","3 Arroyos","210 gr",""
"7791813050582","7 Up 7up Lima Limón Sin Azúcar Lata 354 Ml","7 Up","354 Ml",""
"7791813421917","7 Up Agua Saborizada Con Gas H2oh Limoneto 1.5 L","7 Up","1.5 L",""
"7791813434412","7 Up Gaseosa Lima Limón Sin Azúcar 7Up  1.5 Lts.","7 Up","",""
"7791813421580","7 Up Gaseosas 7up Sin Azúcar Lima Limón 1.5 L","7 Up","1.5 L",""
"7791813777045","7Up Gaseosa 7 Up Lima Limón 1.5 lt","7Up","1.5 lt",""
"7791813777069","7Up Gaseosa 7 Up Lima Limón 3 lt","7Up","3 lt",""
"7790060023684","Aceite De Girasol Cocinero 1.5 L","Cocinero","1.5 L",""
"7790070012050","Aceite De Girasol Cocinero 900 Ml","Cocinero","900 Ml",""
"7790070231819","Aceite de Girasol Cocinero Ecobotella 900 cc.","Cocinero","900 cc",""
"7790272001029","Aceite De Girasol Natura 1.5 L","Natura","1.5 L",""
"7790272001005","Aceite De Girasol Natura 900 Ml","Natura","900 Ml",""
"7790010002943","Aceite Para Bebé Johnsons Baby Puro 100 cc.","Johnsons Baby","100 cc",""
"7500435212601","Acond Pantene Prov Bambu 200 ml","Pantene","200 ml",""
"7500435212212","Acond Pantene Prov Brillo Extremo 200 ml","Pantene","200 ml",""
"7500435211963","Acond Pantene Prov Hidrata 200 ml","Pantene","200 ml",""
"7500435211840","Acond Pantene Prov Restauracion 200 ml","Pantene","200 ml",""
"7791293042756","Acondic Sedal Carbon Activado &Peonias 190ml","Sedal","190ml",""
"7791293050423","Acondicionador Bomba Ceramidas Suave 930 ml.","Suave","930 ml",""
"7500435147583","Acondicionador Head & Shoulders Hidratación Aceite De Coco 300 Ml","Head & Shoulders","300 Ml",""
"7500435241090","Acondicionador Pantene Con Keratina 200 cc.","Pantene","200 cc",""
"7500435229852","Acondicionador Pantene Detox 200 cc.","Pantene","200 cc",""
"7500435230001","Acondicionador Pantene Equilibrio 200 cc.","Pantene","200 cc",""
"7500435211970","Acondicionador Pantene Hidratación 400 ml","Pantene","400 ml",""
"7500435230117","Acondicionador Pantene Pro-V 400 ml","Pantene","400 ml",""
"7500435235433","Acondicionador Pantene Prov Miracles Revit 200 cc.","Pantene","200 cc",""
"7790740000356","Acondicionador Plusbelle Balance 1000 ml","Plusbelle","1000 ml",""
"7790740000479","Acondicionador Plusbelle Control Frizz Esencia 970 cc.","Plusbelle","970 cc",""
"7790740000325","Acondicionador Plusbelle Frescura 1000 ml","Plusbelle","1000 ml",""
"7790740000349","Acondicionador Plusbelle Nutricion 1000 ml","Plusbelle","1000 ml",""
"7790740000363","Acondicionador Plusbelle Protección 1000 ml","Plusbelle","1000 ml",""
"7790740000332","Acondicionador Plusbelle Suavidad 1000 ml","Plusbelle","1000 ml",""
"7791905024699","Acondicionador Polyana Manzana 900 cc.","Polyana","900 cc",""
"7791293047669","Acondicionador Sedal Bomba Argan 190 ml","Sedal","190 ml",""
"7791293042848","Acondicionador Sedal Bomba Nutrición Antifrizz 340 ml.","Sedal","340 ml",""
"7791293040202","Acondicionador Sedal Carbon 190ml","Sedal","190ml",""
"7791293040219","Acondicionador Sedal Carbon 340ml","Sedal","340ml",""
"7791293047690","Acondicionador Sedal Carbón Y Peonias 190 cc.","Sedal","190 cc",""
"7791293047706","Acondicionador Sedal Carbon Y Peonias 340 ml","Sedal","340 ml",""
"7791293045863","Acondicionador Sedal Crema Balance 190 ml","Sedal","190 ml",""
"7791293046426","Acondicionador Sedal Hialuronico Y Vitamina a 190 ml","Sedal","190 ml",""
"7791293047720","Acondicionador Sedal Jengibre Y Ricino 190 cc.","Sedal","190 cc",""
"7791293047737","Acondicionador Sedal Jengibre Y Ricino 340 ml","Sedal","340 ml",""
"7791293045870","Acondicionador Sedal Liso Perfecto 190 ml","Sedal","190 ml",""
"7791293051451","Acondicionador Sedal Luminous Uv 190 ml","Sedal","190 ml",""
"7791293049755","Acondicionador Sedal Prebioticos + Biotina 190 cc.","Sedal","190 cc",""
"7791293045924","Acondicionador Sedal Restauración Repuesto 300 cc.","Sedal","300 cc",""
"7790520993120","Acondicionadores Echo Botella 800 Ml","Echo","800 Ml",""
"7790520995667","Acondicionadores Echo Doypack 450 Cc","Echo","450 Cc",""
"7791337007819","Actimel  multifruta 100 g","Actimel","100 g",""
"7791337009394","Activia Sachet Manzana Frutilla Deslactosado","Activia","",""
"7794000005426","Aderezo Hellmanns Vegana Doypack 250 xg","Hellmann´S","",""
"7793360103025","Aderezo Ketchup Hot La Campagnola 250 gr","La Campagnola","250 gr",""
"7793360103018","Aderezo Ketchup La Campagnola 250 gr","La Campagnola","250 gr",""
"7791866000381","Aderezo Ketchup Natura 250 Gr","Natura","250 Gr",""
"7791866001203","Aderezo Mayonesa Natura 237 Gr","Natura","237 Gr",""
"7791866001364","Aderezo Mayonesa Natura 475 Gr","Natura","475 Gr",""
"7790895643712","Ades Soja + Jugo de Ananá 200 ml","Ades","200 ml",""
"7790895643750","Ades Soja + Jugo de Naranja 200 ml","Ades","200 ml",""
"7791290795792","Aerosol Desinfectante de Ambientes Y Superficies Cif Frescura Cítrica x 360 ml","Cif","360 ml",""
"7790520029522","Aerosol Glade Limited Edition Frescura Salvaje 360 ml","Glade","360 ml",""
"7792931000039","Agua Baja En Sodio Glaciar 2 L","Glaciar","2 L",""
"7792931000015","Agua Baja En Sodio Glaciar 500 Cc","Glaciar","500 Cc",""
"7790895003943","Agua Mineral Bonaqua Con Gas 500 ml","Bonaqua","500 ml",""
"7790895008146","Agua Mineral Bonaqua Sin Gas 2,5 lt","Bonaqua","2,5 lt",""
"7790895003875","Agua Mineral Bonaqua Sin Gas x 1,5 Lts","Bonaqua","",""
"7792799000059","Agua Mineral De Manantial Eco De Los Andes 1.5 L","Eco De Los Andes","1.5 L",""
"7792799000097","Agua Mineral Eco De Los Andes Sin Gas 2 L","Eco De Los Andes","2 L",""
"7792931000022","Agua Mineral Glaciar Sin Gas Bajo Sodio 1.5 L","Glaciar","1.5 L",""
"7790895651151","Agua Saborizada Aquarius de Ananá Y Jengibre 1.5 Lts","Aquarius","",""
"7790895008498","Agua Saborizada Aquarius Limonada 1,5 lt","Aquarius","1,5 lt",""
"7790895008504","Agua Saborizada Aquarius Limonada 2,25 lt","Aquarius","2,25 lt",""
"7790895640483","Agua Saborizada Aquarius Manzana 1.5 L.","Aquarius","1.5 L",""
"7790895003301","Agua Saborizada Aquarius Manzana 2,25 Lt","Aquarius","2,25 Lt",""
"7790895641237","Agua Saborizada Aquarius Naranja 1,5 lt","Aquarius","1,5 lt",""
"7790895003325","Agua Saborizada Aquarius Naranja 2,25 lt","Aquarius","2,25 lt",""
"7790895640476","Agua Saborizada Aquarius Pera 1,5 Lt","Aquarius","1,5 Lt",""
"7790895003295","Agua Saborizada Aquarius Pera 2,25 Lt","Aquarius","2,25 Lt",""
"7790895640490","Agua Saborizada Aquarius Pomelo 1,5 Lt","Aquarius","1,5 Lt",""
"7790895003288","Agua Saborizada Aquarius Pomelo 2,25 Lt","Aquarius","2,25 Lt",""
"7790895003318","Agua Saborizada de Uva Aquarius Sin Gas 2,25 Lts","Aquarius","",""
"7791813423591","Agua Saborizada H2oh! Citrus 2.25 L","H2O","2.25 L",""
"7791813421603","Agua Saborizada H2oh! Citrus x 15 .l","H2oh!","",""
"7791813423911","Agua Saborizada H2oh! Limoneto 2.25 L","H2O","2.25 L",""
"7799155000463","Agua Saborizada Levité Pera 2,25 Lts.","Levite","",""
"7791813403029","Agua Saborizada Sin Gas H2oh! de Limón 1.5 Lts.","H2oh!","",""
"7791813403036","Agua Saborizada Sin Gas H2oh! de Manzana 1.5 Lts.","H2oh!","",""
"7791813000723","Agua Saborizada Sin Gas H2oh de Naranja Pet 1.5 Lts","H2oh!","",""
"7791813403012","Agua Saborizada Sin Gas H2oh de Pomelo 1.5 Lts.","H2oh!","",""
"7799155000180","Agua Villavicencio Sin Gas 15 ,lt","Villavicencio","",""
"7799155000197","Agua Villavicencio Sin Gas 2 lt","Villavicencio","2 lt",""
"7790580131470","Aguila Aguila Baño De Reposteria 150g","Aguila","150g",""
"7790580131494","Aguila Baño De Reposteria Blanco 150g","Aguila","150g",""
"7790580133641","Aguila Baño De Reposteria Celeste 150g","Aguila","150g",""
"7790580133764","Aguila Baño De Reposteria Rosa 150g","Aguila","150g",""
"7790580131487","Aguila Baño De Reposteria S/Amargo150g","Aguila","150g",""
"7790580121891","Aguila Postre Chocotorta 637 g 11 Porciones","Aguila","637 g",""
"7790598000010","Albahaca Don Ubaldo 25 g.","Don Ubaldo","25 g",""
"7790139101015","Alcohol Etílico 70 Desinfec Bialcohol Pet 500 cc.","Bialcohol","500 cc",""
"7790040133587","Alfajor Aguila Minitorta Clasico 69 g","Aguila","69 g",""
"7790040133594","Alfajor Brownie Aguila Mini Torta 71.5 G.","Aguila","71.5 G",""
"7790040659605","Alfajor Cofler Block 60 Gr","Cofler","60 Gr",""
"77903785","Alfajor Milka Triple Mousse 55 Gr","Milka","55 Gr",""
"7790040613706","Alfajor Negro Bon O Bon 40 Gr","Bon O Bon","40 Gr",""
"7790040331303","Alfajor Tatín Blanco 33 g.","Tatín","33 g",""
"7790040405608","Alfajor Tatín Negro 60 g.","Tatín","60 g",""
"7790040405301","Alfajor Tatín Triple Blanco 60 g.","Tatín","60 g",""
"77903860","Alfajor Terrabusi Torta 70 Gr","Terrabusi","70 Gr",""
"7790940000026","Algodón Clasico Hidrofilo Doncella 140 g.","Doncella","140 g",""
"7790940003034","Algodón Doncella Hidrofilo 70 gr","Doncella","70 gr",""
"7790064000124","Algodón Estrella Clásico 140 Gr","Estrella","140 Gr",""
"7790064000131","Algodón Estrella Clásico 300 Gr","Estrella","300 Gr",""
"7790064000261","Algodón Estrella Clásico 75 Gr","Estrella","75 Gr",""
"7794000007451","Almidon de Maiz Maizena S/Tacc 200 xg","Maizena","",""
"7794000007468","Almidon de Maiz Maizena S/Tacc 500 xg","Maizena","",""
"7791120101687","Almohaditas Rellenas Molinos Ala Cacao Y Vainilla 90 g","Molinos Ala","90 g",""
"7790950133349","Amargo Terma Cero Cuyano 1.35 L","Terma","1.35 L",""
"7790950133325","Amargo Terma Cero Serrano 1.35 L","Terma","1.35 L",""
"7790950133332","Amargo Terma Cuyano 1.35 L","Terma","1.35 L",""
"7790950133271","Amargo Terma Limón 1.35 L","Terma","1.35 L",""
"7790950133257","Amargo Terma Pomelo 1.35 L","Terma","1.35 L",""
"7790950133363","Amargo Terma Pomelo Rosado 1.35 L","Terma","1.35 L",""
"7790950133318","Amargo Terma Serrano 1.35 L","Terma","1.35 L",""
"7792798014163","Andes(Cerveza) Cerveza Rubia Andes Origen 710 ml.","Andes(Cerveza)","710 ml",""
"7791293048499","Antitranspirante en Aerosol Dove Granada 150 cc.","Dove","150 cc",""
"7791293048475","Antitranspirante en Aerosol Dove Pepino Y Té Verde 150 cc.","Dove","150 cc",""
"7791293048505","Antitranspirante en Aerosol Dove Pera Y Aloe Vera 150 cc.","Dove","150 cc",""
"7791293033273","Antitranspirante en Aerosol Dove Sensitive 150 ml","Dove","150 ml",""
"7791293049533","Antitranspirante en Aerosol Rexona Cotton Dry 150 cc.","Rexona","150 cc",""
"7791293049472","Antitranspirante en Aerosol Rexona Men Fanaticos 150 cc.","Rexona","150 cc",""
"7791293049465","Antitranspirante en Aerosol Rexona Men Invisible 150 cc.","Rexona","150 cc",""
"7791293049601","Antitranspirante en Aerosol Rexona Men Xtracool 150 cc.","Rexona","150 cc",""
"7791293049557","Antitranspirante en Aerosol Rexona Nutritive 150 cc.","Rexona","150 cc",""
"78935068","Antitranspirante en Roll On Dove Go Fresh 50 cc.","Dove","50 cc",""
"78924345","Antitranspirante Rexona Bamboo Roll On 50 ml","Rexona","50 ml",""
"78944855","Antitranspirante Rol Lon Rexona Nutritive 50 cc.","Rexona","50 cc",""
"78948310","Antitranspirante Roll On Dove Durazno 50 ml","Dove","50 ml",""
"7791293049519","Antitrasnspirante en Aerosol Rexona Antibact 150 cc.","Rexona","150 cc",""
"7791293049458","Antitrasnspirante en Aerosol Rexona Men Antib 150 cc.","Rexona","150 cc",""
"7891136057029","Aperitivo Aperol 750 cc","APEROL","750 cc",""
"7891136052000","Aperitivo Campari 750 Ml","Campari","750 Ml",""
"7791200200781","Aperitivo Con Alcohol Campari Bitter 750 cc.","Campari","750 cc",""
"7791200000619","Aperitivo Cynar 750 cc","CYNAR","750 cc",""
"7791200000626","Aperitivo Cynar 750 ml","CYNAR","750 ml",""
"7790950137804","Aperitivo Dr Lemon Red Berry Bot -1l-","Dr Lemon","1l",""
"7790950000191","Aperitivo Gancia 450 Ml","Gancia","450 Ml",""
"7790950134834","Aperitivo Martini Bianco x 1 l","Martini","1 l",""
"7790950134810","Aperitivo Rosso Martini 1 lt","Martini","1 lt",""
"7790950143690","Aperitivo Sin Alcohol Terma Pomelo Sin Azúcar 1.35 L.","Terma","1.35 L",""
"7790940000019","Apósitos Post Parto Doncella 10 U.","Doncella","",""
"7790742330109","Armonia Crema De Leche Para Cocinar Armonía 200 Cc","Armonia","200 Cc",""
"7790520998262","Aromatizante De Ambientes Glade Campos De Lavanda En Aerosol 360ml","Glade","360ml",""
"7790520998293","Aromatizante De Ambientes Glade Caricias De Algodón En Aerosol 360ml","Glade","360ml",""
"7790520996633","Aromatizante De Ambientes Glade Edición Limitada Dulzura De Mandarina En Aerosol 360ml","Glade","360ml",""
"7790520998279","Aromatizante De Ambientes Glade Limón Refrescante En Aerosol 360ml","Glade","360ml",""
"7790520990884","Aromatizante De Ambientes Glade Mini Gel Hogar Placer Floral Y Frutos Rojos 70gr","Glade","70gr",""
"7790520998286","Aromatizante De Ambientes Glade Paraíso Azul En Aerosol 360ml","Glade","360ml",""
"7791120032554","Arroz 53 Grano Largo Fino 1 Kg","53","1 Kg",""
"7791120098888","Arroz Integral Molinos Ala Bolsa 1 kg.","Molinos Ala","1 kg",""
"7790387070019","Arroz Maria Largo Fino X1kg","Maria","1kg",""
"7790387070026","Arroz Maria Largo Fino X500g","Maria","500g",""
"7791120099847","Arroz Molinos Ala Grano Largo Fino 1kg","Molinos Ala","1kg",""
"7791120100093","Arroz Molinos Ala Grano Largo Fino 500 gr","Molinos Ala","500 gr",""
"7791120099854","Arroz Molinos Ala Parboil 1kg","Molinos Ala","1kg",""
"7791120100109","Arroz Molinos Ala Parboil 500 gr","Molinos Ala","500 gr",""
"7790070433091","Arroz Parboil Gallo Oro en Caja 1 kg","Gallo","1 kg",""
"7792350067019","Arvejas Inalpa Secas Remojadas 300 xgr","Inalpa","",""
"7792350004526","Arvejas Secas Remojadas Inalpa 350 Gr","Inalpa","350 Gr",""
"7792350067163","Arvejas Secas Remojadas Inalpa Sin Sal Vida 300 g.","Inalpa","300 g",""
"7792350067996","Arvejas Secas Sin Sal Inalpa Cormillot 300 g.","Inalpa","300 g",""
"7790580131364","Atun La Campagnola Al Natural 170 xg","La Campagnola","",""
"7790580131357","Atun La Campagnola en Aceite 170 xg","La Campagnola","",""
"7790520995650","Autobrillo Ceramicol Doypack 450 Cc","Ceramicol","450 Cc",""
"7792170555420","Avena Instantánea Quaker Fortificada 500 g.","Quaker","500 g",""
"7791293043838","Axe Desodorante Aerosol Bs Collision 150 ml","Axe","150 ml",""
"7791293044040","Axe Desodorante Aerosol Bs Epic Fresh 150 ml","Axe","150 ml",""
"7790132098459","Ayudin Lavandina Ayudín Clásica 1 L","Ayudin","1 L",""
"7790380016687","Baño de Reposteria Georgalos  150 gr","Georgalos","150 gr",""
"77916501","Barra Cereal Mix Original 23 Gr","Cereal Mix","23 Gr",""
"77916525","Barra Cereal Mix Placeres Chocolate 23 Gr","Cereal Mix","23 Gr",""
"7790580131531","Barra Cofler Chocolinas 40g","Cofler","40g",""
"7790580137571","Barra Cook Raptor 45 g.","Raptor","45 g",""
"77915818","Barra de Cereal Cereal Mix Manzana Light 23 g.","Cereal Mix","23 g",""
"77984395","Barra de Cereal Cereal Mix Pasión de Chocolate 26 g.","Cereal Mix","26 g",""
"7790380020004","Barra de Cereal Flow Granola Chips Y Almendras 23 g","Flow","23 g",""
"7790380020356","Barra de Cereal Toddy  21 xg","Toddy","",""
"7790380020349","Barra Flow Cereal Puro Cacao 24 xg","Flow","",""
"7790950135992","Bebida A Base De Hierbas Terma Citrus 1.35 L","Terma","1.35 L",""
"7790950141610","Bebida a Base de Hierbas Terma Pomelo Rosado","Terma","",""
"7791337010161","Bebida Base Almendra Sabor Mocha x 1 lt Silk","Silk","1 lt",""
"7798422620076","Bebida Energizante Monster Ananá 473 ml","Monster","473 ml",""
"1007084701235","Bebida Energizante Monster Energy 473 Ml","Monster","473 Ml",""
