ID/EAN,NOMBRE,MARCA,PRESENTACION,ID_CATEGORIA
"1007084789417","Bebida Energizante Monster Pineapple en Lata 473 cc.","Monster","473 cc",""
"9002490288341","Bebida Energizante Red Bull Summer Pomerlo en Lata 250 ml","Red Bull","250 ml",""
"7791813111443","Bebida Energizante Rockstar de Maracuyá Pet 500 ml","Rockstar","500 ml",""
"7798422620021","Bebida Energizante Sin Azúcar Monster Ultra Energy en Lata 473 cc.","Monster","473 cc",""
"7798422620069","Bebida Energizante Sin Azúcar Monster Watermelon en Lata 473 ml","Monster","473 ml",""
"7792170042258","Bebida Isotónica Gatorade Cool Blue 500 cc.","Gatorade","500 cc",""
"7792170042241","Bebida Isotónica Gatorade Uva 500 cc.","Gatorade","500 cc",""
"7790895649103","Bebida Isótonica Powerade Citrus Maracuyá 500 ml","Powerade","500 ml",""
"7790895641183","Bebida Isotónica Powerade Frutas Tropicales 500 Ml","Powerade","500 Ml",""
"7790895640018","Bebida Isotónica Powerade Manzana 500 Ml","Powerade","500 Ml",""
"7790895640025","Bebida Isotónica Powerade Mountain Blast 500 Ml","Powerade","500 Ml",""
"7790895640032","Bebida Isotónica Powerade Naranja 500 ml","Powerade","500 ml",""
"7790895651052","Bebida Isotónica Powerade Sour de Manzana Verde 500 ml","Powerade","500 ml",""
"7790742872180","Bebida Lactea Sense Avellana x 200 ml la Serenisima","La Serenisima","200 ml",""
"7790742872654","Bebida Lactea Sense Caramel 200 ml","Sense","200 ml",""
"7790895649615","Bebida Powerade Gold Rush 500 cc","Powerade","500 cc",""
"7790950143706","Bebida Terma Pomelo Sin Azucar x 1,35 Lts","Terma","",""
"7790598000386","Bicarbonato de Sodio Don Ubaldo 50 g.","Don Ubaldo","50 g",""
"7793890259018","Bimbo Pan Hamburguesa Artesano Brioche 240 g","Bimbo","240 g",""
"7790580132286","Bizcochuelo Aguila Chocolate 530 xgr","Aguila","",""
"7790580123420","Bizcochuelo Aguila Marmolado 550 xgr","Aguila","",""
"7790580122300","Bizcochuelo Aguila Torta 450 Gr","Aguila","450 Gr",""
"7790580131760","Bizcochuelo Chocolate Godet 480g","Godet","480g",""
"7791113004605","Bizcochuelo de Chocolate Fortificado Emeth 450 gr","Emeth","450 gr",""
"7791113001444","Bizcochuelo de Coco Emeth Fortificado 450 g.","Emeth","450 g",""
"7791113005466","Bizcochuelo de Dulce de Leche Emeth Fortificado 450 g.","Emeth","450 g",""
"7791113004582","Bizcochuelo de Naranja Emeth Fortificado 450 g.","Emeth","450 g",""
"7791113001420","Bizcochuelo de Vainilla Con Chips Emeth 450 g.","Emeth","450 g",""
"7791113004599","Bizcochuelo Emeth Vainilla Fortificado 450 g.","Emeth","450 g",""
"7790580131753","Bizcochuelo Marmolado Godet500g","Godet","500g",""
"7790520028648","Blem Limpiador Revitalizante Pisos Plastificados Y Flotantes Almendra 400 ml","Blem","400 ml",""
"7790040991910","B&N Alfajor B N Blanco 3.0 73 g.","B&N","73 g",""
"7790040141179","B&N Alfajor Byn Negro 36 x 50 g.","B&N","50 g",""
"7790360982445","Bocaditos de Pollo x 400 gr Swift","Swift","400 gr",""
"77961815","Bombón Chocolate Blanco Bon O Bon 15 g.","Bon O Bon","15 g",""
"7790580146368","Bombones Bon O Bon Coco 15 g","Bon O Bon","15 g",""
"7792360002147","Bonafide Café Molido Torrado Suave Sensaciones 125 g","Bonafide","125 g",""
"7792410522717","Brighton Gin 700 Ml.","Brighton","700 Ml",""
"7795933101735","Caballa Bahía Aceite x 380 gr","Bahía","380 gr",""
"7790150830444","Cacao Chocolino 180g","Chocolino","180g",""
"7790150830468","Cacao Chocolino 360g","Chocolino","360g",""
"7791113000249","Cacao en Polvo Emeth 180 g.","Emeth","180 g",""
"7792280006140","Cachamate Yerba Con Palo Tradicional 500 gr Cachamai","Cachamate","500 gr",""
"7792360002079","Café Bonafide Molido Sabor Intenso 250 Gr","Bonafide","250 Gr",""
"7792360002062","Café Bonafide Molido Sabor Intenso 500 gr","Bonafide","500 gr",""
"7792360002383","Café Bonafide Molido Sensaciones 1 kg","Bonafide","1 kg",""
"7792360002123","Café Bonafide Molido Sensaciones 250 gr","Bonafide","250 gr",""
"7790550011290","Café Cabrales En Saquitos X90g","Cabrales","90g",""
"7792360094968","Café en Saquitos Bonafide Intenso 18 uni","Bonafide","",""
"7790550029417","Café La Planta de Café Clasico Dp 160 xg","La Planta De Café","",""
"7790550000157","Café La Planta De Café Molido 250 Gr","La Planta De Café","250 Gr",""
"7790150100783","Café La Virginia Clasico Espuma X100g","La Virginia","100g",""
"7790150101773","Café La Virginia Suave Espuma X100g","La Virginia","100g",""
"7790150006375","Cafe Molido La Virginia Torrado Equilibrado 1 kg","La Virginia","1 kg",""
"7792360002154","Café Molido Torrado Intenso Bonafide Sensaciones 125 g.","Bonafide","125 g",""
"8445291036291","Café Nescafe Dolca Cortado Cremoso 125 xg","Nescafe","",""
"8445291082175","Café Nescafe Dolca Original 50 xg","Nescafe","",""
"7790070933645","Cafe Suave Mas Aroma Arlistan 100 gr.","Arlistan","100 gr",""
"7790070933638","Cafe Suave Mas Aroma Arlistan 170 gr.","Arlistan","170 gr",""
"7790070933652","Cafe Suave Mas Aroma Arlistan 50 gr.","Arlistan","50 gr",""
"7794000008540","Caldo de Gallina Con Vegetales Knorr 12 Ud.","Knorr","",""
"7794000008557","Caldo de Verdura en Cubos Knorr 12 uni","Knorr","",""
"7794000008274","Caldo de Verdura Knorr Cero Sal 12 uni","Knorr","",""
"7790520028952","Canasta Sólida Pato Marina Full 27,5 gr","Pato","27,5 gr",""
"7792390620700","Capelettini Giacomo Carne 500g","Giacomo","500g",""
"7792390620786","Capelettini Giacomo Que/Jam 500g","Giacomo","500g",""
"7792390620823","Capelettini Giacomo Tridicci 500g","Giacomo","500g",""
"7792390620748","Capelettini Giacomo Verdura 500g","Giacomo","500g",""
"7791218122921","Capellettis Orali  de Carne Y Espinaca 500 g","Oralí","500 g",""
"77987662","Caramelo Halls Cherry 28 g.","Hall´S","28 g",""
"77958631","Caramelos Cherry Menthoplus x 9U","Menthoplus","",""
"7622202271298","Caramelos Halls de Miel Con Menta 26 grs","Hall´S","26 grs",""
"7622202247316","Caramelos Halls Menta Lyptus 25.2 Grs","Hall´S","25.2 Grs",""
"77905291","Caramelos Halls Stani Miel Y Menta 28 g.","Hall´S","28 g",""
"77946812","Caramelos Menthoplus Durazno x 27 gr","Menthoplus","27 gr",""
"77958655","Caramelos Menthoplus Sabor Miel X 30 G","Menthoplus","30 G",""
"77958648","Caramelos Strong Menthoplus x 9U","Menthoplus","",""
"7790139003173","Casalta Vinagre De Alcohol Clasico Botella 1 Lt.","Casalta","1 Lt",""
"7794450090492","Catena Zapata Vino Tinto Catena D.V. Cabernet - Malbec 750 Cc","Catena Zapata","750 Cc",""
"7791118013206","Cebada El Pocillo 115 g","El Pocillo","115 g",""
"7791118013343","Cebada Intensa El Pocillo Doy Pack 115 grs","El Pocillo","115 grs",""
"7790520995599","Cera Líquida Pisos Cerámicos Blem Floral Repuesto Económico 450ml","Blem","450ml",""
"7790520992949","Cera Líquida Pisos Cerámicos Blem Incoloro Botella 800ml","Blem","800ml",""
"7790520995582","Cera Líquida Pisos Cerámicos Blem Incoloro Repuesto Económico 450ml","Blem","450ml",""
"7790520995605","Cera Líquida Pisos Cerámicos Blem Rojo Repuesto Económico 450ml","Blem","450ml",""
"7790040140936","Cereal Mix Galletitas Dulces Careal Mix Sabor Frutilla 150 grs","Cereal Mix","150 grs",""
"8445290615893","Cereal Nestum Multicereal  225 xg","Nestum","",""
"7790040142510","Cereales Formis Frutal 245 xg","Formis","",""
"7793147572402","Cerveza Amstel Lager 473 Sixpack","Amstel","",""
"7793147572051","Cerveza Amstel Lager 473 Sixpack","Amstel","",""
"7793147572044","Cerveza Amstel Lager 473cc","Amstel","473cc",""
"7793147572853","Cerveza Amstel Lager 710 cc","Amstel","710 cc",""
"7792798012572","Cerveza Andes Fresquita Origen 473 cc.","Andes","473 cc",""
"7792798002757","Cerveza Andes Ipa Retornable 1lt","Andes","1lt",""
"7792798002139","Cerveza Andes Negra Retornable 1lt","Andes","1lt",""
"7792798012879","Cerveza Andes Origen Fresquita 1 lt","Andes","1 lt",""
"7792798012589","Cerveza Andes Origen Fresquita Fourpack","Andes","",""
"7792798011254","Cerveza Andes Origen Ipa Roja Lata x 473 ml","Andes Origen","473 ml",""
"7792798001712","Cerveza Andes Origen Rubia 473cc Six Pack","Andes","473cc",""
"7792798014156","Cerveza Andes Origen Rubia 710 cc","Andes","710 cc",""
"7792798014958","Cerveza Andes Origen Rubia Oro 473 cc 6Un","Andes","473 cc",""
"7792798002337","Cerveza Andes Roja 473 Cc Six Pack","Andes","473 Cc",""
"7792798002122","Cerveza Andes Roja Reornable T 1lt","Andes","1lt",""
"7792798002115","Cerveza Andes Rubia Ret 1lt","Andes","1lt",""
"7792798015061","Cerveza Blanca Brahma en Lata 710 ml","Brahma","710 ml",""
"7792798014705","Cerveza Blanca Corona en Lata 473 cc","Corona","473 cc",""
"7792798013777","Cerveza Blanca Ipa Patagonia Estelar en Lata 473 cc.","Patagonia","473 cc",""
"7792798014934","Cerveza Blanca Oro Andes Origen en Lata 473 ml","Andes","473 ml",""
"7792798013821","Cerveza Blanca Patagonia Ipa Estelar en Lata X6 473 cc.","Patagonia","473 cc",""
"7792798003938","Cerveza Blanca Patagonia Vera Ipa en Lata 473 cc.","Patagonia","473 cc",""
"7792798003945","Cerveza Blanca Patagonia Vera Ipa en Lata X6 473 cc.","Patagonia","473 cc",""
"7792798009107","Cerveza Blanca Quilmes Sin Alcohol 473 cc. 1 U.","Quilmes","473 cc",""
"7793147573393","Cerveza Blanca Schneider Afa en Lata 473 cc.","Schneider","473 cc",""
"7792798014873","Cerveza Blanca Sin Alcohol 0.0 Corona Porrón 330 cc.","Corona","330 cc",""
"7792798013487","Cerveza Blanca Stella Artois 0.0 en Lata 473 cc.","Stella Artois","473 cc",""
"7792798013494","Cerveza Blanca Stella Artois 0.0 X6 473 cc.","Stella Artois","473 cc",""
"7792798010578","Cerveza Blanca Stella Artois Porrón 330 cc.","Stella Artois","330 cc",""
"7793147573355","Cerveza Blanca Warsteiner Pilsener en Lata 473 cc.","Warsteiner","473 cc",""
"7793147001056","Cerveza Budweiser 1lt Retornable","Budweiser","1lt",""
"7792798014491","Cerveza Budweiser Música en Lata 473 cc.","Budweiser","473 cc",""
"7792798014507","Cerveza Budweiser Música en Lata 473 cc.","Budweiser","473 cc",""
"7792798002375","Cerveza Con Trigo Patagonia Weisse 730 Ml Botella Descartable","Patagonia","730 Ml",""
"7793147574109","Cerveza Golden 330 cc Imperial","Imperial","330 cc",""
"7793147572242","Cerveza Grolsch 473 cc Six Pack","Grolsch","473 cc",""
"7793147570866","Cerveza Grolsch 473 Ml","Grolsch","473 Ml",""
"7793147570842","Cerveza Grolsch 925cc Retornable","Grolsch","925cc",""
"7793147572877","Cerveza Grolsch Ipa 473 cc Sixpack","Grolsch","473 cc",""
"7793147572846","Cerveza Grolsch Ipa  473 cc","Grolsch","473 cc",""
"7793147573119","Cerveza Heineken 150 Años 710 cc","Heineken","710 cc",""
"7793147009243","Cerveza Heineken 354 ml - Pack 6","Heineken","354 ml",""
"7802100003270","Cerveza Heineken Cero 330 cc","Heineken","330 cc",""
"7793147571863","Cerveza Heineken Premium 473 ml Six Pack","Heineken","473 ml",""
"7793147571283","Cerveza Heineken Premiun 710 Cc","Heineken","710 Cc",""
"7793147000899","Cerveza Heineken Ret 1lt","Heineken","1lt",""
"7793147572280","Cerveza Imperial Apa 473 cc Six Pack","Imperial","473 cc",""
"7793147573720","Cerveza Imperial Golden 1 l","Imperial","1 l",""
"7793147572297","Cerveza Imperial Golden 473 cc Sixpack","Imperial","473 cc",""
"7793147571689","Cerveza Imperial Golden 473cc Lata","Imperial","473cc",""
"7793147571726","Cerveza Imperial Golden 473cc Six Pack","Imperial","473cc",""
"7793147572624","Cerveza Imperial Golden 710 cc","Imperial","710 cc",""
"7793147572273","Cerveza Imperial Ipa 473 cc Sixpack","Imperial","473 cc",""
"7793147570743","Cerveza Imperial Ipa 473cc Lata","Imperial","473cc",""
"7793147570330","Cerveza Imperial Ipa Ret 1lt (hasta 12 unidades)","Imperial","1lt",""
"7793147571870","Cerveza Imperial Lager 473 cc Sixpack","Imperial","473 cc",""
"7793147572754","Cerveza Imperial Roja 473 cc Sixpack","Imperial","473 cc",""
"7793147573737","Cerveza Imperial Rubia 1 l","Imperial","1 l",""
"7793147571412","Cerveza Imperial Rubia 710cc Lata","Imperial","710cc",""
"7793147572266","Cerveza Imperial Stout 473 cc Sixpack","Imperial","473 cc",""
"7793147001742","Cerveza Imperial Stout 473cc Lata","Imperial","473cc",""
"7792798002788","Cerveza Ipa Andes Origen Sixpack 473 Ml Lata","Andes","473 Ml",""
"7793147573515","Cerveza Isenbeck 473 ml","Isenbeck","473 ml",""
"7793147573591","Cerveza Lager Suave Amstel 1 lt.","Amstel","1 lt",""
"7793147118822","Cerveza Lata Budweiser 473 cc","Budweiser","473 cc",""
"7792798014019","Cerveza Light Michelob Ultra en Lata 473 cc.","Michelob","473 cc",""
"7793147571382","Cerveza Miller 710 Cc","Miller","710 Cc",""
"7792798002399","Cerveza Patagonia 24.7 730 ml","Patagonia","730 ml",""
"7792798004331","Cerveza Patagonia Abrazo de Oso Lata 4731 mlx","Patagonia","",""
"7792798012961","Cerveza Patagonia Amber Lager 1 lt Retornable","Patagonia","1 lt",""
"7792798003846","Cerveza Patagonia Hoppy Lager 730 Cc No Retornable","Patagonia","730 Cc",""
"7792798015023","Cerveza Patagonia Lager Del Sur 730 cc","Patagonia","730 cc",""
"7792798010882","Cerveza Patagonia Vera Ipa 730 cc","Patagonia","730 cc",""
"7793147572723","Cerveza Roja Imperial Lata 473 cc.","Imperial","473 cc",""
"7792798007158","Cerveza Roja Patagonia Amber Lager 730 ml Botella Descartable","Patagonia","730 ml",""
"7792798002351","Cerveza Roja Patagonia Amber Lager 730 Ml Botella Descartable","Patagonia","730 Ml",""
"7793147573546","Cerveza Rubia Amstel Lager 473 ml","Amstel","473 ml",""
"7792798999866","Cerveza Rubia Andes Origen 473 cc.","Andes","473 cc",""
"7793147118846","Cerveza Rubia Budweiser 6-Pack 473 ml Lata","Budweiser","473 ml",""
"7792798015344","Cerveza Rubia Corona 0% Alcohol 473 ml","Corona","473 ml",""
"7793147009137","Cerveza Rubia Heineken 330 cc.","Heineken","330 cc",""
"7793147573324","Cerveza Rubia Imperial Extra Lager en Lata 473 cc.","Imperial","473 cc",""
"7793147573560","Cerveza Rubia Imperial Golden Ligera en Lara 473 cc.","Imperial","473 cc",""
"7792798002368","Cerveza Rubia Patagonia Bohemian Pilsener 730 Ml Botella Descartable","Patagonia","730 Ml",""
"7792798007165","Cerveza Rubia Patagonia Bohemian Pilsener 730 ml Botella Descartable","Patagonia","730 ml",""
"7792798002382","Cerveza Rubia Patagonia Kune 730 cc","Patagonia","730 cc",""
"7792798006045","Cerveza Rubia Stella Artois Porrón 330 cc","Stella Artois","330 cc",""
"7793147571856","Cerveza Schneider 473 ml - Pack 6","Schneider","473 ml",""
"7793147118860","Cerveza Schneider 473 Ml","Schneider","473 Ml",""
"7793147570606","Cerveza Schneider Rubia 710cc Lata","Schneider","710cc",""
"7793147574093","Cerveza Sin Alcohol Heineken en Lata 473 ml","Heineken","473 ml",""
"7793147574130","Cerveza Sin Alcohol Imperial Golden 0% en Lata 473 ml","Imperial","473 ml",""
"7792798015351","Cerveza Sin Alcohol Sixpack x 473 cc C / U Corona","Corona","473 cc",""
"7792798010592","Cerveza Stella Artois 473cc Six Pack","Stella Artois","473cc",""
"7792798012701","Cerveza Stella Artois Blanche Lata x 473 ml","Stella Artois","473 ml",""
"7792798010639","Cerveza Stella Artois Noire Lata x 473 ml","Stella Artois","473 ml",""
"7792798010561","Cerveza Stella Artois Pura Malta 975 cc Retornable","Stella Artois","975 cc",""
"7792798014385","Cerveza Stella Artois Vinage Rubia 473 cc Sixpa","Stella Artois","473 cc",""
"7792798014361","Cerveza Stella Artois Vintage 473 ml","Stella Artois","473 ml",""
"7793147572303","Cerveza Warsteiner 473 ml - Pack 6","Warsteiner","473 ml",""
"7795933703236","Champaña Fresita Original 750 Ml","Fresita","750 Ml",""
"77919489","Chicle Sandia Menta Topline 67 ,gr","TOPLINE","",""
"7790580121013","Chicle Topline Redberry Frutilla Ultra 7 12 U.","TOPLINE","",""
"77948588","Chicle Topline Sandía 14 g.","TOPLINE","14 g",""
"77948496","Chicle Topline Seven Violet Cherry 14 gr","TOPLINE","14 gr",""
"77916426","Chicles Topline Tableta Menta 6.7 G.","TOPLINE","6.7 G",""
"77916419","Chicles Topline Ultra Defense Sin Azúcar X 4 un","TOPLINE","",""
"7794520869010","Chizitos Krach-Itos Sabor Queso 170 xg","Krach-Itos","",""
"7792350067040","Choclo Amarillos Inalpa Tipo Cremoso 300 xgr","Inalpa","",""
"7790580132422","Choclo Arcor Entero 300 xg","Arcor","",""
"7793360984907","Choclo Cremoso La Campagnola 300 gr","La Campagnola","300 gr",""
"7793360132414","Choclo Entero Arcor La Campagnola 300 g","La Campagnola","300 g",""
"7790380004882","Choco Repost Semiamargo Georgalos 150 gr","Georgalos","150 gr",""
"7790407031013","Chocolate Aguila Para Taza 100 Gr","Aguila","100 Gr",""
"7790407031273","Chocolate Aguila Para Taza 150 Gr","Aguila","150 Gr",""
"7790580109882","Chocolate Aguila Para Taza 150 Gr","Aguila","150 Gr",""
"7790580105822","Chocolate Aguila Para Taza 225 Gr","Aguila","225 Gr",""
"7790407031075","Chocolate Blanco Aguila Para Taza 100 Gr","Aguila","100 Gr",""
"7622201818654","Chocolate Cadbury Frutilla Yoghurt 29 g.","Cadbury","29 g",""
"77922120","Chocolate Cofler Block Con Maní 110 Gr","Cofler","110 Gr",""
"7790580111755","Chocolate Cofler Con Leche 45 Gr","Cofler","45 Gr",""
"7790580123642","Chocolate Cofler Yougurt Frutilla 64 xgr","Cofler","",""
"77974631","Chocolate Con Leche Relleno Tofi 28 gr","Tofi","28 gr",""
"77974648","Chocolate Tofi Blanco Relleno 27 gr","Tofi","27 gr",""
"7790040143234","Chocolinas Galletitas Chocolina de Chocolate 250 g.","Chocolinas","250 g",""
"7790895646355","Coca Cola Gaseosa Coca-Cola Cafe 220 Ml","Coca Cola","220 Ml",""
"7790895000904","Coca Cola Gaseosa Coca-Cola Sabor Original 354 Ml Multipack X6","Coca Cola","354 Ml",""
"7790895000232","Coca Cola Gaseosa Coca-Cola Sabor Original 354 Ml","Coca Cola","354 Ml",""
"7790895642104","Coca Cola Gaseosa Coca-Cola Sin Azúcar 220 Ml","Coca Cola","220 Ml",""
"7790895067587","Coca Cola Gaseosa Coca-Cola Sin Azúcar 354 Ml","Coca Cola","354 Ml",""
"7790580134730","Codito La Campagnola Pastas Secas  500 Gr","La Campagnola","500 Gr",""
"7790040143654","Cofler Alfajor Simple Block 40.7 G.","Cofler","40.7 G",""
"7790580141776","Cofler Arcor 60 tabl.a.naran 100 gr","Cofler","100 gr",""
"7790580123741","Cofler Graffiti Blanco Leche 45 Gr","Cofler","45 Gr",""
"7794297020485","Colador de Plastico Deses Plast 30 cm","Deses Plast","",""
"7791600060145","Colonia Chester Ice 60 ml","Chester Ice","60 ml",""
"7791600047115","Colonia Flowers Coqueterias 80 ml","Coqueterias","80 ml",""
"7791600173029","Colonia Para Niños Paco 90 ml","Paco","90 ml",""
"7791600050092","Colonia Para Niños Pibes 80 ml","Pibes","80 ml",""
"7790598012136","Comino Molido Don Ubaldo 25 g.","Don Ubaldo","25 g",""
"7794000004917","Condimento Sabor Al Horno Knorr Cebolla Y Ajo 21 g","Knorr","21 g",""
"7794520869607","Conitos Krachitos x Treme Hot 45 grs","Krachitos","45 grs",""
"7790790120837","Conserva Vegetales Choclo Cremoso Amarillo Inca 350 gr","Inca","350 gr",""
"7791019000213","Copos De Maíz 3 Arroyos 400 Gr","3 Arroyos","400 Gr",""
"7790040139770","Coquitas Galletitas Melitas 159 g","Coquitas","159 g",""
"7798001560175","Crema de Leche Cremigal 190 ml","Cremigal","190 ml",""
"7891150055780","Crema Dental Close Up Protección Bioactiva 70 grs","Close Up","70 grs",""
"7891150049895","Crema Dental Close Up Triple Protección 70 grs","Close Up","70 grs",""
"7790787030118","Crema Doble Ilolay 200 ml","Ilolay","200 ml",""
"7891010255213","Crema Humectante Para Bebe Rosa Johnsons Baby 200 g.","Johnsons Baby","200 g",""
"7790040124516","Criollitas Tostadas Salvado 195gr","Criollitas","195gr",""
"7791337008083","Danet / Danette Postre Crema America Danette 190 gr","Danet / Danette","190 gr",""
"7798062540109","Danone Agua Villa Del Sur Sin Gas 600cc","Danone","600cc",""
"7790520995322","Desinfectante Amb Lysoform Citrica 360cc","Lysoform","360cc",""
"7791290796362","Desinfectante en Aerosol Cif Floral 360 ml","Cif","360 ml",""
"7791290795785","Desinfectante en Aerosol Cif Lavanda 360 cc.","Cif","360 cc",""
"7790520031426","Desinfectante en Aerosol Lysoform Frutos Del Bosque 360 ml","Lysoform","360 ml",""
"7791600028589","Desodorante Acqua Di Colbert en Aerosol Masculino 123 cc.","Colbert","123 cc",""
"7791293049540","Desodorante Active Emotion Women Rexona 150 ml.","Rexona","150 ml",""
"7791905023777","Desodorante Aerosol Dufour Women Freedom 125 cc.","Dufour","125 cc",""
"7791905024385","Desodorante Aerosol Men Dufour Sport 155 cc.","Dufour","155 cc",""
"7791600127237","Desodorante Aerosol Paco Surf 150 ml","Paco","150 ml",""
"7791293042718","Desodorante Axe Dark Temtation 150 ml","Axe","150 ml",""
"7791600060473","Desodorante Chester Ice en Aerosol Masculino 123 cc.","Chester Ice","123 cc",""
"7791600030346","Desodorante Ciel en Aerosol Femenino 123 cc.","Ciel","123 cc",""
"7790520028730","Desodorante de Ambiente Glade Campos Lavanda en Aerosol 360 cc.","Glade","360 cc",""
"7790520028822","Desodorante de Ambiente Glade Caricias de Algodón en Aerosol 360 cc.","Glade","360 cc",""
"7790520028785","Desodorante de Ambiente Glade Cherry en Aerosol 360 cc.","Glade","360 cc",""
"7790520028754","Desodorante de Ambiente Glade Limón en Aerosol 360 cc.","Glade","360 cc",""
"7790520028853","Desodorante de Ambiente Glade Mañana de Campo en Aerosol 360 cc.","Glade","360 cc",""
"7790520031570","Desodorante de Ambiente Glade Naranjo Y Orquideas 360 ml","Glade","360 ml",""
"7790520028860","Desodorante de Ambiente Glade Paraiso Azul en Aersol 360 cc.","Glade","360 cc",""
"7790520028815","Desodorante de Ambiente Glade Potpourri en Aerosol 360 cc.","Glade","360 cc",""
"7790520028792","Desodorante de Ambiente Glade Tropical Floral en Aerosol 360 cc.","Glade","360 cc",""
"7790520028761","Desodorante de Ambiente Glade Vainilla en Aerosol 360 cc.","Glade","360 cc",""
"7790520998200","Desodorante de Ambientes Glade Aerosol Flores Tropicales Y Coco 360 ml","Glade","360 ml",""
"7791293048482","Desodorante Dove Antitranspirante Go Fresh Pomelo x 150 ml","Dove","150 ml",""
"7791293048468","Desodorante Dove Original Antitranspirante 150 ml","Dove","150 ml",""
"7791293048529","Desodorante en Aerosol Dove Invisible Dry x 150 ml","Dove","150 ml",""
"7791600022136","Desodorante en Aerosol Femenino Ciel Crystal 0% Alcohol 144 cc.","Ciel","144 cc",""
"7791600620240","Desodorante en Aerosol Paco Futbol 150 ml","Paco","150 ml",""
"7791293049700","Desodorante en Aerosol Patrichs Grand 230 cc.","Patrichs","230 cc",""
"7791600066444","Desodorante Flower Rose en Aerosol Femenino 123 cc.","Flower Rose","123 cc",""
"7791293049571","Desodorante Fútbol Fanáticas Women Rexona 150 ml.","Rexona","150 ml",""
"7791600521356","Desodorante Gino Bogani 123 ml","Gino Bogani","123 ml",""
"7791600102388","Desodorante Gino Bogani Chic To Cheek 123 ml","Gino Bogani","123 ml",""
"7791293049526","Desodorante Invisible Women Rexona 150 ml.","Rexona","150 ml",""
"7791600037239","Desodorante Kevin en Aerosol Masculino 123 cc.","Kevin","123 cc",""
"7791600952853","Desodorante La Dolfina Stud 150 ml","La Dolfina","150 ml",""
"7791905004202","Desodorante Masculino Polyana Sport 172 ml","Polyana","172 ml",""
"7791905004219","Desodorante Masculino Polyana Wood Tone 172 ml","Polyana","172 ml",""
"7791293049502","Desodorante Men Rexona 150 ml.","Rexona","150 ml",""
"7791600595340","Desodorante Mujercitas Aerosol Femenino 150 cc.","Mujercitas","150 cc",""
"7791600091156","Desodorante Mujercitas Julie En Aerosol X 123 ml","Mujercitas","123 ml",""
"7791600173357","Desodorante Paco en Aerosol Masculino 150 cc.","Paco","150 cc",""
"7791600311247","Desodorante Paula Alegria 123 ml","Paula Alegria","123 ml",""
"78944848","Desodorante Rexona Active Emotion Roll On 50 ml","Rexona","50 ml",""
"7791293049564","Desodorante  Rexona  bamboo Y Aloe Women  150 ml","Rexona","150 ml",""
"78944794","Desodorante Rexona Invisible Roll On 50 ml","Rexona","50 ml",""
"78924338","Desodorante Roll-On Power Dry Rexona 50 ml","Rexona","50 ml",""
"7791293049489","Desodorante V8 Men Rexona 150 ml.","Rexona","150 ml",""
"7791600079277","Desodorante Valeria Mazza Velvet 123 ml","Valeria Mazza","123 ml",""
"7791600045593","Desororante Paula Cahen 123 ml","Paula Cahen","123 ml",""
"7791290794108","Detergente Cif Bioactive Lima 300 cc.","Cif","300 cc",""
"7791290795280","Detergente Ropa Fina Ala Camellito Matic Dp 450 cc.","Ala","450 cc",""
"7791905003335","Detergente Ropa Liquido Querubin Botella 3lt","Querubin","3lt",""
"7791905003366","Detergente Ropa Liquido Querubin Doy 3lt","Querubin","3lt",""
"7790520010506","Discos Adhesivos Pato Marina Repuesto 36 ml","Pato","36 ml",""
"7790940515032","Discos Desmaquillantes Doncella 80 U","Doncella","",""
"7795293101338","DISCOS DON YEYO TARTA CRIOLLA 380 GRS","Don Yeyo","380 GRS",""
"7795293601296","DON YEYO PAN HAMBURGUESAS X4 X210G","Don Yeyo","210G",""
"7790940234025","Doncella Protector Diario Pocket Sin Perfume (40 u)","Doncella","",""
"7790940216144","Doncella Toallitas Fem C/Ala Pocket C/D x 8","Doncella","",""
"7791293051635","Dove Men Desodorante Aer All Body Shea Butter & Cedar 150 ml","Dove","150 ml",""
"7790950134100","Dr Lemon Aperitivo Dr. Lemon Con Limon 1 L","Dr Lemon","1 L",""
"7790950131918","Dr Lemon Aperitivo Dr. Lemon Con Vodka 1 L","Dr Lemon","1 L",""
"7790950136432","Dr Lemon Aperitivo Dr. Lemon Con Vodka Naranja 1 L","Dr Lemon","1 L",""
"7790950134896","Dr Lemon Aperitivo Dr. Lemon Con Vodka Y Pomelo 1 L","Dr Lemon","1 L",""
"7790950133691","Dr Lemon Aperitivo Dr. Lemon Mojito 1 L","Dr Lemon","1 L",""
"7790580504809","Dulce de Batata Arcor Con Chocolate Estuche 500 g.","Arcor","500 g",""
"7791113005749","Dulce de Batata Bandeja Emeth 500 g.","Emeth","500 g",""
"7791113001543","Dulce de Batata Emeth 500 gr.","Emeth","500 gr",""
"7791113001550","Dulce de Batata Emeth Con Chocolate 500 gr.","Emeth","500 gr",""
"7790787153664","Dulce de Leche Clásico Ilolay 415 gr.","Ilolay","415 gr",""
"7790742625403","Dulce De Leche Colonial La Serenisima 1kg","La Serenisima","1kg",""
"7790742625106","Dulce De Leche Colonial La Serenisima 250 Gr","La Serenisima","250 Gr",""
