ID/EAN,NOMBRE,MARCA,PRESENTACION,ID_CATEGORIA
7790520028082,Discos Adhesivos Inodoro Lavanda Aplicadorrep 38g Pato,PATO,38g,limpieza
7793253007072,Quitamanchas Ropa Polvo Neutro 450 Grs Trenet,TRENET,Quitamanchas Power Precision Polvo 450g Trenet,limpieza
7790520028952,"Canasta para Inodoros Marina 27,5 Grs Pato",PATO,Canasta Sólida Inodoro Marina Aparato  Rep 27.5g Pato,limpieza
7790520031549,Aromatizante de Ambiente Naranjo y Orquídeas 270 Ml Glade,GLADE,270 ml,limpieza
7791290795846,Limpiador Desinfectante De Superficies Cif Gel Original 500 Ml,CIF,500 ml,limpieza
7791130963497,Detergente para Ropa Oscura 450 Ml Woolite,WOOLITE,450 ml,limpieza
7794440760008,Bolsas de Residuos Virulana Reforzadas 45x60 Cm x 30 Un,VIRULANA,Bolsa Rollo S X 30 Un Virulana,limpieza
7794440760015,Bolsas de Residuos Virulana Reforzadas 50x70 Cm x 30 Un,VIRULANA,Bolsa Rollo M X 30 Un Virulana,limpieza
7791130963428,Detergente Woolite Todos Los Dias Dp 900ml,WOOLITE,900ml,limpieza
7798131250724,Detergente para Lavavajillas Ultra Limón 500 Ml Héroe,HEROE,500 ml,limpieza
7790520028419,Limpiador Desinfectante Solución Total Lavanda 900ml Lysoform,LYSOFORM,900ml,limpieza
7790520031914,Cera Líquida para Cerámicos Incolora 750 Ml Blem,BLEM,750 ml,limpieza
7790520028044,Limpiavidrios Platinum Original 360 Ml Mr Musculo,MR MUSCULO,360 ml,limpieza
7794440007141,Pala Virulana Con Goma,VIRULANA,Pala Virulana Con Goma,limpieza
7790520028884,Lustramuebles Aerosol Granito Marmol Naranja 360cc Blem,BLEM,360cc,limpieza
7798131250205,Limpiador Liquido Heroe Pino Silvestre 900 Cc,HEROE,900 cc,limpieza
7798131250731,Lavavajillas Heroe Ultra Manzana 500cc,HEROE,500cc,limpieza
7702626204178,Quitamanchas Polvo Ropa Color 450 Grs Vanish,VANISH,Quitamanchas Polvo Ropa Color 450 Grs Vanish,limpieza
7790520029539,Aromatizante Automático Mango Tropical Rep 270ml Glade,GLADE,270ml,limpieza
7790520028426,Limpiador Líquido Desinfectante Floral Botella 875ml Lysoform,LYSOFORM,875ml,limpieza
7798131250199,Limpiador Multiuso Lavanda 900 Ml Héroe,HEROE,900 ml,limpieza
7790520031518,Limpiador Multisuperficies Floral Repuesto 400ml Blem,BLEM,400ml,limpieza
7790520999320,Limpiador De Baño Líquido Repuesto 450 Ml Mr Músculo,MR MUSCULO,450 ml,limpieza
7790520028440,Limpiador Desinfectante Lavanda 1760 Ml Lysoform,LYSOFORM,1760 ml,limpieza
7790990003848,Jabón en Polvo Bicarbonato 800 Grs Zorro,ZORRO,Detergente Polvo Bicarbonato 800g Zorro,limpieza
7790520028464,Limpiador Desinfectante Solución Total Bosque de Pinos 1760 Ml Lysoform,LYSOFORM,1760 ml,limpieza
7500435243612,Suavizante para Ropa Brisa Suave 500 Ml Downy,DOWNY,500 ml,limpieza
7793253170615,Aromatizante De Ambientes Poett Natural Blends Frutal 400 Cm3,POETT,400 cm3,limpieza
7790520995438,Limpiador Desinfectante Multisuperficie 500 Ml Lysoform,LYSOFORM,500 ml,limpieza
7791199003028,Repelente De Insectos Fush Spray 200ml,FUSH,200ml,limpieza
7794321801189,Bolsas de Residuos Task Cierre Fácil 50x65 Cm x 20 Un,TASK,Bolsa Cf Task 50x65 20u,limpieza
7808718510674,Bolígrafo Paper Mate Kilometrico InkJoy x 3 Un,PAPER MATE,Bolígrafo Kilométrico Surtido X3 Un Paper Mate,tiempo-libre
7794757260819,Témpera Color Peps x 12 Un 8 Ml Maped,MAPED,8 ml,tiempo-libre
7791762814686,Block Liso Avon A4 80 Hojas,AVON,Block Liso Avon A4 80 Hojas,tiempo-libre
7501030682332,Bolígrafo Paper Mate Kilometrico InkJoy 1.0 Mm x 4 Un,PAPER MATE,Bolìgrafo Kilométrico Fun Colors X 4 Un Paper Mate,tiempo-libre
7791293051437,Shampoo Luminous Uv X 340 Ml Sedal,SEDAL,340 ml,perfumeria
7791293051468,Acondicionador Luminous Uv X 340 Ml Sedal,SEDAL,340 ml,perfumeria
7791293051208,Jabon En Barra Original Individual 90 Grs Dove,DOVE,Jabon En Barra Original Individual 90 Grs Dove,perfumeria
7791293049960,Acondicionador Keratina Antifrizz X 500 Ml Tresemmé,TRESEMMÉ,500 ml,perfumeria
7790250097617,Toallitas Comfort Soft 8 Un Ladysoft,LADYSOFT,Toallitas Comfort Soft 8 Un Ladysoft,perfumeria
7791293048826,Jabón Líquido Botanicals Rosas Francesas 220 Ml Lux,LUX,220 ml,perfumeria
7891150104839,Shampoo Dove Bond Uv Repair 400ml,DOVE,400ml,perfumeria
7891150097124,Oleo + Sérum Bond Intense Repair 110 Ml Dove,DOVE,110 ml,perfumeria
7509546702636,Pasta Dental Original Mint 140 Grs Colgate Total,COLGATE,Pasta Dental Original Mint 140 Grs Colgate Total,perfumeria
7791293051017,Shampoo Dove Bond Intense Repair 400 Ml,DOVE,400 ml,perfumeria
7500435231237,Shampoo Anticomezón 375 Ml Head & Shoulders,HEAD & SHOULDERS,375 ml,perfumeria
7891150095700,Jabón De Tocador Piel Sensible 90 Grs X 3 Un Dove,DOVE,Jabón De Tocador Piel Sensible 90 Grs X 3 Un Dove,perfumeria
7791293050126,Acondicionador Liso Perfecto Profesional X 500 Ml Tresemmé,TRESEMMÉ,500 ml,perfumeria
7891150095618,Jabón De Tocador Piel Sensible 90 Grs Dove,DOVE,Jabón De Tocador Piel Sensible 90 Grs Dove,perfumeria
7791293050560,Crema De Peinar Sedal Rizos Definidos 300 Ml,SEDAL,300 ml,perfumeria
7790250097655,Toallitas Normal Soft 16 Un Ladysoft,LADYSOFT,Toallitas Normal Soft 16 Un Ladysoft,perfumeria
7791293051444,Shampoo Luminous Uv X 650 Ml Sedal,SEDAL,650 ml,perfumeria
7791293050928,Jabón En Barra Bamboo Multipack 120 Grs X 3 Un Rexona,REXONA,Jabón En Barra Bamboo Multipack 120 Grs X 3 Un Rexona,perfumeria
7509552964165,Acondicionador Probiotics X 350 Ml Fructis,FRUCTIS,350 ml,perfumeria
7790250097648,Toallitas Normal Soft 8 Un Ladysoft,LADYSOFT,Toallitas Normal Soft 8 Un Ladysoft,perfumeria
7509552964394,Acondicionador Dream Liso X 400 Ml Elvive,ELVIVE,400 ml,perfumeria
7791293049878,Acondicionador Brillo Lamelar X 500 Ml Tresemmé,TRESEMMÉ,500 ml,perfumeria
7500435235365,Acondicionador Pro-v Miracles Liso Infinito 400 Ml Pantene,PANTENE,400 ml,perfumeria
7509552930344,Acondicionador Elvive Glyco Gloss 400ml,ELVIVE,400ml,perfumeria
7509552979558,Serum Liso 7 Dias Dream Liso X 100 Ml Elvive,ELVIVE,100 ml,perfumeria
7506306254459,Desodorante Dove Men Sport Fresh 150ml,DOVE,150ml,perfumeria
7891150097148,Acondicionador Dove Bond Intense Repair 250 Ml,DOVE,250 ml,perfumeria
7790033338197,Shampoo Brillo Anti-residuos Glycolic Cristal X 400 Ml Elvive,ELVIVE,400 ml,perfumeria
7790250097662,Toallitas Normal Protect 8 Un Ladysoft,LADYSOFT,Toallitas Normal Protect 8 Un Ladysoft,perfumeria
7509552935615,Crema Para Peinar Elvive Oleo Rizo,ELVIVE,Crema Para Peinar Elvive Oleo Rizo,perfumeria
7891024134702,Pasta Dental Máxima Protección Anticaries 90 Grs Colgate,COLGATE,Pasta Dental Máxima Protección Anticaries 90 Grs Colgate,perfumeria
7500435248037,Shampoo Anti Caida 300 Ml Pantene,PANTENE,300 ml,perfumeria
7794626014949,Toallita Femenina Esencial X 16 U Kotex,KOTEX,Toallita Femenina Esencial X 16 U Kotex,perfumeria
7509552925890,Shampoo Elvive Extraordinario Riso 400 Ml,ELVIVE,400 ml,perfumeria
7509552964554,Shampoo Dream Liso X 200 Ml Elvive,ELVIVE,200 ml,perfumeria
7500435191456,Shampoo Colageno X 510 Ml Pantene,PANTENE,510 ml,perfumeria
7798140257851,Shampoo Anticanas 415 Ml Tio Nacho,TIO NACHO,415 ml,perfumeria
7791293050775,Jabon Liquido Glicerina Manzanilla 220 Ml Lux,LUX,220 ml,perfumeria
7500435243674,Mascarilla Intensiva Restauración 270 Ml Pantene,PANTENE,270 ml,perfumeria
7891150103504,Oleo Dove Bond  Repair Uv 110ml,DOVE,110ml,perfumeria
7791293050911,Jabon De Tocador Sensible 120 Grs X 3 Un Rexona,REXONA,Jabon De Tocador Sensible 120 Grs X 3 Un Rexona,perfumeria
7509552964417,Acondicionador Dream Liso X 200 Ml Elvive,ELVIVE,200 ml,perfumeria
7509546690315,Cepillo Dental Colgate Max White Charcoal X2u,COLGATE,Cepillo Dental Colgate Max White Charcoal X2u,perfumeria
7791293050263,Acondicionador Detox Capilar X 500 Ml Tresemmé,TRESEMMÉ,500 ml,perfumeria
7500435191494,Acondicionador Colageno X 510 Ml Pantene,PANTENE,510 ml,perfumeria
7500435235334,Acondicionador Pro-v Miracles Volumen 400 Ml Pantene,PANTENE,400 ml,perfumeria
7891150103481,Tratamiento Dove Bond Uv Repair 250ml,DOVE,250ml,perfumeria
7791293051543,Rexona All Body Desodorante Aero Wild Rose 150ml,REXONA,150ml,perfumeria
7506306255050,Desodorante Spray Cherry Spritz X 150 Ml Axe,AXE,150 ml,perfumeria
7790250097624,Toallitas Nocturna Soft 8 Un Ladysoft,LADYSOFT,Toallitas Nocturna Soft 8 Un Ladysoft,perfumeria
7791293051581,Rexona All Body Desodorante Aero Active Fresh 150ml,REXONA,150ml,perfumeria
7791293051475,Acondicionador Luminous Uv X 650 Ml Sedal,SEDAL,650 ml,perfumeria
7500435249348,Shampoo Nuhoney 375 Ml Head & Shoulders,HEAD & SHOULDERS,375 ml,perfumeria
7891150097131,Máscara De Tratamiento Dove Bond Intense Repair 250 Gr,DOVE,250 gr,perfumeria
7791293051574,Rexona All Body Desodorante Aero Ocean Rush 150ml,REXONA,150ml,perfumeria
7791293050607,Desodorante En Aerosol Musk 230 Ml Axe,AXE,230 ml,perfumeria
7509546695525,Pasta Dental Natural Herbal Protect 140 Grs Colgate,COLGATE,Pasta Dental Natural Herbal Protect 140 Grs Colgate,perfumeria
7896009498978,Crema Dental Protección Completa X 140 Gr Sensodyne,SENSODYNE,140 gr,perfumeria
7500435248044,Acondicionador Anti Caida X 510 Ml Pantene,PANTENE,510 ml,perfumeria
7500435247979,Shampoo Anti Caida 510 Ml Pantene,PANTENE,510 ml,perfumeria
7791293050812,Jabon Lux Botan Lirio Azul 3x120g,LUX,120g,perfumeria
7500435230094,Shampoo Pantene Pro-v Miracles Hidrata Y Fortalece 400 Ml,PANTENE,400 ml,perfumeria
7793008017936,Shampoo Issue Express Color Rubio 25 Ml,ISSUE,25 ml,perfumeria
7891150101784,Serum Sedal Oleo Toque De Seda X 100 Ml Seda,SEDAL,100 ml,perfumeria
7509552928877,Serum Capilar Elvive Glyco Gloss 100ml,ELVIVE,100ml,perfumeria
7793008017943,Shampoo Color Express Castaño 25 Ml Issue,ISSUE,25 ml,perfumeria
7791293051642,Dove Men Desodorante Aero All Body Fig & Suede 150ml,DOVE,150ml,perfumeria
7500435241052,Shampoo Keratina X 510 Ml Pantene,PANTENE,510 ml,perfumeria
7793008020431,Coloracion Castaño Claro Issue Express,ISSUE,Coloracion Castaño Claro Issue Express,perfumeria
7509552930337,Acondicionador Elvive Glyco Gloss 200ml,ELVIVE,200ml,perfumeria
7500435169486,Repuesto Gillette Mach3 Extra Lub X3u,GILLETTE,Repuesto Gillette Mach3 Extra Lub X3u,perfumeria
7500435231244,Shampoo Anticomezón 180 Ml Head & Shoulders,HEAD & SHOULDERS,180 ml,perfumeria
7891150099906,Sérum Capilar Luminous Uv 110 Ml Sedal,SEDAL,110 ml,perfumeria
7509552925913,Acondicionador Elvive Extraordinario Rizos 400 Ml,ELVIVE,400 ml,perfumeria
7899706188340,Protector Solar Lóreal Paris Uv Defender Fluid,LÓREAL PARIS,Protector Solar Lóreal Paris Uv Defender Fluid,perfumeria
7791293051550,Rexona All Body Desodorante Aero Fresh Citrus 150ml,REXONA,150ml,perfumeria
7506306249981,Desodorante Aerosol Blue Lavender 150 Ml Axe,AXE,150 ml,perfumeria
7793008019725,Coloracion Leau Vive Numero 1,L'EAU VIVE,Coloracion Leau Vive Numero 1,perfumeria
7506306255067,Desodorante Spray Peach Infusion X 150 Ml Axe,AXE,150 ml,perfumeria
7500435243681,Mascarilla Intensiva Hidratación 270 Ml Pantene,PANTENE,270 ml,perfumeria
7791293050454,Acondicionador  Suave Vitaminas Bomba Deliciosa  930 Ml,SUAVE,930 ml,perfumeria
7891150101647,Mascarilla Capilar Toque De Seda X 300 Grs Sedal,SEDAL,Mascarilla Capilar Toque De Seda X 300 Grs Sedal,perfumeria
7793008019060,Fijador Roby Fuerte 180 Ml,ROBY,180 ml,perfumeria
7509552902846,Shampoo Elvive Kera-liso Mk 400ml,ELVIVE,400ml,perfumeria
7791293051024,Shampoo Dove Bond Intense Repair 200 Ml,DOVE,200 ml,perfumeria
7509552937343,Shampoo Elvive Glyco Gloss 200 Ml,ELVIVE,200 ml,perfumeria
7891150104822,Shampoo Dove  Bond Uv Repair 200ml,DOVE,200ml,perfumeria
7509546693736,Cepillo de Dientes Total Whitening Suave 2 Un Colgate,COLGATE,Cepillo De Dientes Total Whitening Suave 2 Un Colgate,perfumeria
7793008020424,Coloracion Rubio Natural Issue Express,ISSUE,Coloracion Rubio Natural Issue Express,perfumeria
7791293050416,Shampoo Vitaminas Bomba Deliciosa 930 Ml Suave,SUAVE,930 ml,perfumeria
7790740001797,Acondicionador Plusbelle Esen Oleo Nut Argan 700 Ml,PLUSBELLE,700 ml,perfumeria
7509546703640,Kit Cepillo portable Y Dentrifico Total X 30 Grs colgate,COLGATE,Kit Cepillo portable Y Dentrifico Total X 30 Grs colgate,perfumeria
7506460101088,Bandas Depilatorias De Bikini Y Axila De Cera Fría Para Piel Sensible,VEET,Bandas Depilatorias De Bikini Y Axila De Cera Fría Para Piel Sensible,perfumeria
7793008017929,Shampoo Issue Color Express Negro 25 Ml,ISSUE,25 ml,perfumeria
7500435241045,Acondicionador Keratina X 510 Ml Pantene,PANTENE,510 ml,perfumeria
7791293049779,Acondicionador Prebioticos Biotina 650 Ml Sedal,SEDAL,650 ml,perfumeria
7793008019053,Fijador Roby Extra Fuerte 180 Ml,ROBY,180 ml,perfumeria
7509552923940,Kit De Coloracion Nutrisse Tono 67p - Chocolate Intenso,NUTRISSE,Kit De Coloracion Nutrisse Tono 67p - Chocolate Intenso,perfumeria
7791293050850,Jabón En Barra Lirio Azul 120 Grs Lux,LUX,Jabón En Barra Lirio Azul 120 Grs Lux,perfumeria
7791293049748,Shampoo Prebioticos Biotina 650 Ml Sedal,SEDAL,650 ml,perfumeria
7509552922295,Acondicionador Fructis Aloe Water 350 Ml,FRUCTIS,350 ml,perfumeria
7791293050881,Máscara De Tratamiento Hidratación Completa  300 Grs Dove,DOVE,Máscara De Tratamiento Hidratación Completa  300 Grs Dove,perfumeria
7793008019770,Coloracion Leau Vive Numero 7,L'EAU VIVE,Coloracion Leau Vive Numero 7,perfumeria
7500435249355,Shampoo Nuhoney 180 Ml Head & Shoulders,HEAD & SHOULDERS,180 ml,perfumeria
7891024116319,Cepillo 360 Deep Clean Pack X 2 Colgate,COLGATE,Cepillo 360 Deep Clean Pack X 2 Colgate,perfumeria
7791293051482,Crema Peinar Luminous Uv X 300 Ml Sedal,SEDAL,300 ml,perfumeria
7791293050072,Shampoo Tresemmé Liso Efecto Botox 250 Ml,TRESEMMÉ,250 ml,perfumeria
7798140257868,Acondicionador Anticanas 415 Ml Tio Nacho,TIO NACHO,415 ml,perfumeria
7791293050430,Acondicionador Suave Vitaminas Bomba Jazmín 930 Ml,SUAVE,930 ml,perfumeria
7791293047034,Shampoo Dove Ritual De Reparación Coco 200 Ml,DOVE,200 ml,perfumeria
7793008019749,Coloracion Leau Vive Numero 4,L'EAU VIVE,Coloracion Leau Vive Numero 4,perfumeria
7500435191586,Acondicionador Colageno X 250 Ml Pantene,PANTENE,250 ml,perfumeria
7500435247955,Acondicionador Anti Caida X 250 Ml Pantene,PANTENE,250 ml,perfumeria
7509552948172,Coloracion Renovacion Tono 3 Excellence,EXCELLENCE,Coloracion Renovacion Tono 3 Excellence,perfumeria
7790033338173,Acondicionador Brillo Cristalino Glycolic Cristal X 400 Ml Elvive,ELVIVE,400 ml,perfumeria
7793008019787,Coloracion Leau Vive Numero 8,L'EAU VIVE,Coloracion Leau Vive Numero 8,perfumeria
7509552948073,"Coloracion Renovacion Tono 7,11 Excellence",EXCELLENCE,"Coloracion Renovacion Tono 7,11 Excellence",perfumeria
7509546690285,Pasta Dental Sensitive Pro Alivio Inmediato Xtreme 110 Grs Colgate,COLGATE,Pasta Dental Sensitive Pro Alivio Inmediato Xtreme 110 Grs Colgate,perfumeria
7509552923933,Kit De Coloracion Nutrisse Tono 60 - Capuccino,NUTRISSE,Kit De Coloracion Nutrisse Tono 60 - Capuccino,perfumeria
7791293048048,Jabon De Tocador Lemongrass Y Flores Blancas 90 Grs X 3 Un Lux,LUX,Jabon De Tocador Lemongrass Y Flores Blancas 90 Grs X 3 Un Lux,perfumeria
7793742003004,Cremas Cuidado Diario X 40 Gr Hipoglos,HIPOGLOS,40 gr,perfumeria
7509552948097,Coloracion Renovacion Tono 8 Excellence,EXCELLENCE,Coloracion Renovacion Tono 8 Excellence,perfumeria
7794640170102,Desodorante Hinds Delicious Roll On 60gr,HINDS,60gr,perfumeria
7891150099920,Máscara De Tratamiento Luminous Uv 300 Grs Sedal,SEDAL,Máscara De Tratamiento Luminous Uv 300 Grs Sedal,perfumeria
7891024179437,Enjuague Bucal Luminous White Brilliant 500 Ml Colgate,COLGATE,500 ml,perfumeria
7791293050768,Jabon Liquido Lux Glicerina Bromelia 220 Ml,LUX,220 ml,perfumeria
7500435243698,Acondicionador 3 Minute Miracle Nutrición 170 Ml Pantene,PANTENE,170 ml,perfumeria
7794626012822,Toalla Femenina Lina Esencial C/a 16u,LINA,Toalla Femenina Lina Esencial C/a 16u,perfumeria
7509552948547,Coloracion Renovacion Tono 4 Excellence,EXCELLENCE,Coloracion Renovacion Tono 4 Excellence,perfumeria
7793008019756,Coloracion Leau Vive Numero 5,L'EAU VIVE,Coloracion Leau Vive Numero 5,perfumeria
7791293051659,Dove Desodorante Aero All Body Lavender & Camomile 150ml,DOVE,150ml,perfumeria
7794626014956,Protector Diario Esencial X 20 U Kotex,KOTEX,Protector Diario Esencial X 20 U Kotex,perfumeria
7791293047041,Acondicionador Dove Ritual De Reparación Coco 200 Ml,DOVE,200 ml,perfumeria
7509552947991,Coloracion Renovacion Tono 6  Excellence,EXCELLENCE,Coloracion Renovacion Tono 6  Excellence,perfumeria
7509552948004,"Coloracion Renovacion Tono 6,1 Excellence",EXCELLENCE,"Coloracion Renovacion Tono 6,1 Excellence",perfumeria
7791293047874,Jabon De Tocador Glicerina Manzanilla 90 Grs Lux,LUX,Jabon De Tocador Glicerina Manzanilla 90 Grs Lux,perfumeria
7509552948189,Coloracion Renovacion Tono 1 Excellence,EXCELLENCE,Coloracion Renovacion Tono 1 Excellence,perfumeria
7891010882990,Hidratante Hydro Boost Gel Crema Ojos 15 Gr Neutrogena,NEUTROGENA,15 gr,perfumeria
7891010251031,Agua Micelar Bifásica Hydro Boost 200 Ml Neutrogena,NEUTROGENA,200 ml,perfumeria
7509552948028,"Coloracion Renovacion Tono 6,34 Excellence",EXCELLENCE,"Coloracion Renovacion Tono 6,34 Excellence",perfumeria
7500435249331,Shampoo Nuhoney 650 Ml Head & Shoulders,HEAD & SHOULDERS,650 ml,perfumeria
7509546702605,Crema Dental Total Original Mint X 90 Grs Colgate,COLGATE,Crema Dental Total Original Mint X 90 Grs Colgate,perfumeria
7793742004698,Protector Solar Fps 30 Emulsión 130 Ml Dermaglós,DERMAGLOS,130 ml,perfumeria
7791293051420,Shampoo Luminous Uv X 190 Ml Sedal,SEDAL,190 ml,perfumeria
7791293051666,Deo Fem Dove Allbody Raspberry X 150ml,DOVE,150ml,perfumeria
7790033338166,Tratamiento Brillo Anti-residuos Glycolic Cristal X 300 Ml Elvive,ELVIVE,300 ml,perfumeria
7790773008459,Toallitas Desmaquillantes 25 Un Qsoft,QSOFT,Toallitas Desmaquillantes 25 Un Qsoft,perfumeria
7500435237604,Pañales Deluxe Mediano X 52 Un Pampers,PAMPERS,Pañales Deluxe Mediano X 52 Un Pampers,mundo-bebe
7798181641411,Leche Bebé 1 Advanced 200 Ml Sancor,SANCOR BEBE,200 ml,mundo-bebe
7790250042792,Pañales Soft M x 48 Un Babysec,BABYSEC,Pañales Premium Soft M X 48 Un Babysec,mundo-bebe
7896061990687,Toallas Húmedas Ultrafresh 50 Un Babysec,BABYSEC,Toallas Húmedas Ultrafresh 50 Un Babysec,mundo-bebe
7500435237598,Pañales Deluxe Protection G x 44 Un Pampers,PAMPERS,Pañales Deluxe G X 44 Un Pampers,mundo-bebe
7702425632189,Toallas Humedas Limpieza Diaria 112 Unidades Huggies,HUGGIES,Toallas Humedas Limpieza Diaria 112 Unidades Huggies,mundo-bebe
7794626015359,Pañales Classic XG 30 Un Huggies,HUGGIES,Pañales Classic G Xg 30 Un Huggies,mundo-bebe
7790010002950,Shampoo para Niños Gotas de Brillo 200 Ml Johnson's,JOHNSON BABY,200 ml,mundo-bebe
7790010003308,Shampoo Kids Fragancia Prolongada 400 Ml Johnson's,JOHNSON BABY,400 ml,mundo-bebe
7790010002967,Shampoo Niños Gotas de Brillo 400 Ml Johnson's,JOHNSON BABY,400 ml,mundo-bebe
7798181641459,Leche Bebé 3 Advanced 200 Ml Sancor,SANCOR BEBE,200 ml,mundo-bebe
7790010003254,Acondicionador para Bebé Cabello Claro 400 Ml Johnson's,JOHNSON´S,400 ml,mundo-bebe
7790010002912,Colonia Baby Fresca Caricia 200 Ml Johnson's,JOHNSON & JOHNSON,200 ml,mundo-bebe
7790010002974,Shampoo Para Niños Hidratación Intensa X 200 Ml Johnson's,JOHNSON BABY,200 ml,mundo-bebe
7891010257378,Shampoo Para Bebé Original Refill X 180 Ml  Johnson's,JOHNSON BABY,180 ml,mundo-bebe
7790010003278,Acondicionador Para Bebé Original 400 Ml Johnson´s,JOHNSON´S,400 ml,mundo-bebe
7794626013973,Toallitas Húmedas La Sirenita 48 Un Huggies,HUGGIES,Toallas Húmedas Huggies La Sirenita 48u,mundo-bebe
7702031244592,Fecula Johnson´s Baby Origin 200 Gr,JOHNSON BABY,200 gr,mundo-bebe
7790010003193,Jabón Líquido para Bebé Glicerina 200 Ml Johnson's,JOHNSON & JOHNSON,200 ml,mundo-bebe
7790010003261,Acondicionador para Bebé Original 200 Ml Johnson's,JOHNSON´S,200 ml,mundo-bebe
7790070036605,Patitas De Pollo Granja Del Sol Original X 1100 Gr,GRANJA DEL SOL,1100 gr,congelados
7790070036599,Patitas De Pollo Granja Del Sol Original  X 400 Gr,GRANJA DEL SOL,400 gr,congelados
7790360982018,Rebozados de Pollo 380 Grs Swift,SWIFT,Crunchies De Pollo Swift X 380 Gr,congelados
7798342151407,Burger Crispy 2 Un X 100 Gr Not Chicken,NOT CHICKEN,100 gr,congelados
7891515629458,Rebozados de Pollo Dinosaurio 400 Grs Sadia,SADIA,Nuggets Saurio X 400 Gr Sadia,congelados
7891515629465,Nuggets Saurio Sadia X 900 Gr,SADIA,900 gr,congelados
7790670052791,Hamburguesa Paty De Cancha  250 Gr,PATY,250 gr,congelados
7790070040046,Pizza Sabor Mozzarella y Jamón Familiar x 1 Un 530 Grs Sibarita,SIBARITA,Pizza Sibarita Mozzarella Y Jamón X530g,congelados
7798342151124,Nuggets Sabor Tradicional Vegano x 15 Un 300 Grs Not Chicken,NOT CHICKEN,Nuggets 300 Gr Not Chicken,congelados
7790070040015,Pizza Sibarita Mozzarella Clásica X470g,SIBARITA,470g,congelados
7790670052562,Espinaca Green Life 550 Gr,GREEN LIFE,550 gr,congelados
7790670052593,Acelga Green Life 550 Gr,GREEN LIFE,550 gr,congelados
7790670052722,Medallon Green Life Lenteja Y Zanahoria X 4 380 Gr,GREEN LIFE,380 gr,congelados
7798342151582,Not Chicken Crispy The Not Co Rellena Espinaca 240 Gr,NOT CHICKEN,240 gr,congelados
7891515586720,Alitas de Pollo Crocantes 400 Grs Sadia,SADIA,Alitas De Pollo Golden X 400 Gr Sadia,congelados
7798342151377,Medallón Sabor Tradicional Carne Vegana x 2 Un 160 Grs Notburguer,NOTBURGUER,Medallón The Not Co Premium Not Burger 160 Gr X 2 U,congelados
7790360982247,Nuggets de Brócoli Veggies 300 Grs Swift,SWIFT,Nuggets De Brocoli X 300 Gr Swift,congelados
7790670052616,Chaucha Green Life 350 Gr,GREEN LIFE,350 gr,congelados
7790670052586,Brocoli Green Life 450 Gr,GREEN LIFE,450 gr,congelados
7790670052708,Medallon Green Life Calabaza Y Choclo X 4 380 Gr,GREEN LIFE,380 gr,congelados
7790670052999,Milanesas de Soja Rebozadas x 4 Un 340 Grs Good Mark,GOOD MARK,Medallon De Soja 4 Un X 340 Gr Good Mark,congelados
7798342151391,Medallón Sabor Tradicional Carne Vegana x 2 Un 240 Grs Notburguer,NOTBURGUER,Medallón The Not Co Premium Not Burger 240 Gr X 2 U,congelados
7790670052739,Medallones de Sabor Arvejas y Brócoli 380 Grs x 4 Un Green Life,GREEN LIFE,Medallon Green Life Arveja Y Brocoli X 4 380 Gr,congelados
7790360982254,Nuggets de Espinaca 300 Grs Swift,SWIFT,Nuggets De Espinaca X 300 Gr Swift,congelados
7891515588410,Bastones de Pollo Sabor Crocantes 300 Grs Sadia,SADIA,Crunchy Chicken Golden X 300 Gr Sadia,congelados
7790670052555,Choclo Amarillo 350 Grs Green Life,GREEN LIFE,Choclo Green Life 350 Gr,congelados
7798342151971,Milanesa Sabor Semillas Congelada x 2 Un 220 Grs Notco,NOTMILA,Notmila Con Semillas 2 Un X 110 Grs Notco,congelados
7790670052715,Medallones de Verduras Sabor Espinaca y Pimientos 380 Grs x 4 Un Green Life,GREEN LIFE,Medallon Green Life Espinaca Y Pimento X 4 380 Gr,congelados
7790670052609,Arvejas Congeladas 350 Grs Green Life,GREEN LIFE,Arveja Green Life 350 Gr,congelados
7790174001301,Medallones de Verduras 300 Grs x 4 Un Vegetalex,VEGETALEX,Medallón Verduras 300 Gr Vegetalex,congelados
7792180143402,Pizza Sabor Mozzarella y Jamón Familiar Precocida x 1 Un 675 Grs Pietro,PIETRO,Pizza Pietro Mozzarella Y Jamon 510g,congelados
7790174001325,Medallones de Legumbres y Quinoa 300 Grs x 4 Un Vegetalex,VEGETALEX,Medallón Legumbres 300 Gr Vegetalex,congelados
7891000115619,Alimento Para Perros Dog Chow Adultos 100 Gr,DOG CHOW,100 gr,mascotas
7806810221009,Rallador Manual Acero Inoxidable 1 Un Ilko,ILKO,Rallador Ilko,hogar-y-textil
7806810210010,Tostador Manual Aluminio 1 Un Ilko,ILKO,Tostador  Ilko 121001 Aluminio - Negro Y Plateado,hogar-y-textil
7806810200028,Molde Redondo Acero Estañado 26 Cm x 1 Un Ilko,ILKO,Molde Ilko - 26 Cm – Plateado,hogar-y-textil
7793015001041,Repuesto Termo Vidrio 1 Lts 29 Cm x 1 Un Lumilagro,SD,1 lts,hogar-y-textil
7806810209670,Moldes Tarteletas Acero Inoxidable 12 Cm x 4 Un Ilko,ILKO,Set 4 Tarteletas Ilko 12 Cm Ilko,hogar-y-textil
7790503199099,Arroz Parboil Dos Hermanos 1 Kg,Dos Hermanos,1 kg,500039
7622202839962,Galletitas Dulces Terrabusi Variedad 390 G,Terrabusi,390 g,500306
7792200000319,Bizcochos 9 De Oro Azucaradas 210g,9 De Oro,210g,500306
7792180004741,Pan Rallado Mama Cocina 500 G,Mama Cocina,500 g,500636
7622202293733,Galletita Club Social Sabor Original 144gr,Club Social,144gr,500685
7790070265333,Aceite Fritolim Cocinero Clásico 120 G,Cocinero,120 g,500024
7790040719804,Galletita Snacks Rex 125 Gr,Rex,125 gr,500685
7790150150276,Café Instantáneo La Virginia Tostado 150 G,La Virginia,150 g,500290
7790503000296,Aritos De Arroz Sabor Crema Y Cebolla Dos Hermanos 80 Gr,Dos Hermanos,80 gr,300174
7790040143517,Galletitas Dulces Rumba Rellenas De Vainilla 110 G,Rumba,110 g,500305
7794000008274,Caldo De Verduras Knorr Cero Sodio 96 G,Knorr,96 g,300087
7790070335982,Fideos Tirabuzón Matarazzo Libre De Gluten 500gr,Matarazzo,500gr,500051
7790045827733,Galletitas Granix Sin Sal 200 G,Granix,200 g,500278
7794000008281,Caldo Knorr De Verduras Cero Sodio 48 G 6u,Knorr,48 g,300087
7790272008394,Aceite De Oliva Natura Virgen Extra Suave 500 Ml,Natura,500 ml,500023
7798224212080,Ají Molido La Parmesana 15 G,La Parmesana,15 g,300114
7790199602910,Pan Rallado Morixe X 500 Gr,Morixe,500 gr,500636
7790070507372,Jugo De Limón Eco Minerva 250 G,Minerva,250 g,500010
7794870000330,Aceite Mezcla Siglo De Oro 900 Ml,SIGLO DE ORO,900 ml,500025
7798224213261,Jengibre Molido La Parmesana 15 G,La Parmesana,15 g,300114
7790310986615,Chizitos De Maiz Maicitos Pehuamar 265 Gr,Pehuamar,265 gr,500681
7798151953551,Pasta De Maní Mani King Vita 350 G,Mani King,350 g,500283
7798224212363,Condimento La Parmesana Para Curry 15 G,La Parmesana,15 g,300114
7792180140562,Pan Rallado Mama Cocina Con Ajo Y Perejil 500g,Mama Cocina,500g,500636
7793890259261,Pan De Mesa Lactal De Salvado Con Semillas 330 G,Lactal,330 g,500633
